,titulo,nome_canal,likes_video_(em_milhares),inscritos_canal_(em_milhoes),dia,mes,ano,nome_site,url,imagem,largura_imagem,altura_imagem,descricao,tipo,tags,visualizacoes
106,Aula 5.0: [Teoria] MANOVA - Modelos estatísticos,Alcinei Azevedo - Dicas e aulas,0.025,,30,11,2021,YouTube,https://www.youtube.com/watch?v=5mcjwLqDY7s,https://i.ytimg.com/vi/5mcjwLqDY7s/hqdefault.jpg,480,360,Nessa aula falo sobre modelos estatísticos associados aos delineamentos experimentais.,video.other,blocos,920.0
597,UE5 USA MACHINE LEARNING (A.I) PARA ANIMAÇÕES REALISTAS EM GAMES,Detonando Gueek,0.321,,10,4,2023,YouTube,https://www.youtube.com/watch?v=B9O4t8c5RII,https://i.ytimg.com/vi/B9O4t8c5RII/maxresdefault.jpg,1280,720,"A UE5 mostrou no State of Unreal uma série de tecnologias impressionantes, entre os destaques esta o Machine Learning Deformer, a criação realista de animaçõ...",video.other,Detonando Gueek,3257.0
175,Concurso Unificado do TSE | Tudo o que você precisa saber!,Professor Fabiano Pereira,2.3,,4,4,2022,YouTube,https://www.youtube.com/watch?v=UKOyL5DxBhc,https://i.ytimg.com/vi/UKOyL5DxBhc/maxresdefault.jpg,1280,720,"🏁 MENTORIA START 90 - Quer ter o meu acompanhamento pessoal e chegar aos 90% de acertos, em apenas 4 meses de preparação, com foco no Concurso Unificado do ...",video.other,justiça eleitoral concurso,108684.0
101,Aula 34: O que São os Modelos ARMA?,Alexandre Cunha Costa,0.084,,19,2,2021,YouTube,https://www.youtube.com/watch?v=NVlotp99NWM,https://i.ytimg.com/vi/NVlotp99NWM/maxresdefault.jpg,1280,720,"Olá, eu sou o Prof Alexandre Cunha Costa (http://lattes.cnpq.br/9241372014553970). Seja bem-vindo ao curso de Introdução à Análise de Séries Temporais: do ze...",video.other,análise de dados,1176.0
391,Machine Learning em Português (Aula 1) - O que é Machine Learning,Zurubabel,0.715,,21,5,2018,YouTube,https://www.youtube.com/watch?v=1degLJSjwwM,https://i.ytimg.com/vi/1degLJSjwwM/hqdefault.jpg,480,360,Nesta vídeo aula do curso de machine learning em português eu falo um pouco sobre o que é Machine Learning e um pouco da diferença entre a programação estáti...,video.other,O que é Machine Learning,11647.0
177,Confiabilidade Analisando Falhas com Modelos Estatísticos,Marcos Coque,0.389,,17,8,2015,YouTube,https://www.youtube.com/watch?v=HxKmVk2Q4mI,https://i.ytimg.com/vi/HxKmVk2Q4mI/maxresdefault.jpg,1280,720,A análise de Confiabilidade permite mensurar quantitativamente os riscos de falhas em diversas áreas. Nesta palestra será apresentado como utilizar modelos e...,video.other,Statistics (Field Of Study),7452.0
211,Deep Learning - L14 Redes neurais recorrentes part1,Dalcimar Casanova,0.05,,19,6,2020,YouTube,https://www.youtube.com/watch?v=n7jWzlMDT-0,https://i.ytimg.com/vi/n7jWzlMDT-0/maxresdefault.jpg,1280,720,Aula 14 - Redes neurais recorrentesOs slides do curso códigos exemplos estão disponíveis em: https://github.com/dalcimar/RC18EE---Intro-to-Deep-LearningBio d...,video.other,Vanishing Gradient,361.0
609,Vivo Keyd Stars 1 x 0 INTZ | CBLOL Academy 2023: 1ª Etapa - Playoffs - Md5,CBLOL,1.2,1.0,Transmissão,,há,YouTube,https://www.youtube.com/watch?v=qUHTD4-UhE8,https://i.ytimg.com/vi/qUHTD4-UhE8/maxresdefault_live.jpg,1280,720,CBLOL Academy 2023: 1ª Etapa acontece de 23 de Janeiro a 22 de Abril com transmissões AO VIVO no YouTube e Twitch de CBLOL às 17h (Horário de Brasília).Curti...,video.other,playoffs,8.0
220,Desafio Kaggle: Prevendo Doenças do Coração com Python - PARTE 1,DevVerso \\x5bBR\\x5d,0.089,,11,7,2022,YouTube,https://www.youtube.com/watch?v=juKW9Hjsktc,https://i.ytimg.com/vi/juKW9Hjsktc/maxresdefault.jpg,1280,720,"Mais um exercício de Classificação, nessa primeira parte iremos explorar e preparar os dados antes de iniciar os modelos de Machine Learning.O link do Desafi...",video.other,Classificação,707.0
511,Quanto Ganha um Cientista de Dados?,Mario Filho,0.8190000000000001,,11,10,2021,YouTube,https://www.youtube.com/watch?v=Vg9zJVTQUxc,https://i.ytimg.com/vi/Vg9zJVTQUxc/maxresdefault.jpg,1280,720,Timestamps:0:00 Intro0:34 Cargos e Níveis das Vagas1:40 Salário #12:20 Salário #23:04 Salário #33:24 Qual é mais fácil de conseguir emprego?4:21 Como ganhar ...,video.other,,6740.5
396,MarI/O - Machine Learning for Video Games,SethBling,181.0,2.0,13,6,2015,YouTube,https://www.youtube.com/watch?v=qv6UVOQ0F44,https://i.ytimg.com/vi/qv6UVOQ0F44/maxresdefault.jpg,1280,720,"MarI/O is a program made of neural networks and genetic algorithms that kicks butt at Super Mario World.Source Code: http://pastebin.com/ZZmSNaHX""NEAT"" Paper...",video.other,MarI/O,898089.5
583,Transfer learning and Transformer models (ML Tech Talks),TensorFlow,2.8,,22,7,2021,YouTube,https://www.youtube.com/watch?v=LE3NfEULV6k,https://i.ytimg.com/vi/LE3NfEULV6k/maxresdefault.jpg,1280,720,"In this session of Machine Learning Tech Talks, Software Engineer from Google Research, Iulia Turc, will walk us through the recent history of natural langua...",video.other,Iulia Turc,51745.0
471,O que é o Bóson de Higgs? #bosondehiggs,Ciência Química!,0.306,,11,4,2023,YouTube,https://www.youtube.com/watch?v=nP_hw4FVjsU,https://i.ytimg.com/vi/nP_hw4FVjsU/maxresdefault.jpg,1280,720,"Bóson de HiggsImagine o começo de tudo, antes de ocorrer o Big Bang, o todo se baseava em uma densidade extremamente quente e desforme, algo até um tanto qua...",video.other,particulas,10969.0
156,Como eu aprenderia Data Science em 2022 (se começasse do zero) - Data Hackers,Data Hackers,2.3,,18,1,2022,YouTube,https://www.youtube.com/watch?v=K2Vu6E5Ybmo,https://i.ytimg.com/vi/K2Vu6E5Ybmo/maxresdefault.jpg,1280,720,"E se eu tivesse que aprender e começar em Ciência de Dados tudo de novo, se tivesse que começar hoje? Nesse vídeo eu dou dicas sobre quais estratégias eu seg...",video.other,python,1152835.0
566,Séries Temporais e Processos Estocásticos - Distribuições de Probabilidade,Prof. Dr. Petronio Silva,0.015,,13,8,2021,YouTube,https://www.youtube.com/watch?v=BxmvnrqvI2o,https://i.ytimg.com/vi/BxmvnrqvI2o/maxresdefault.jpg,1280,720,,video.other,,150.0
64,Analise Espectral e Modelos ARIMA - Ruído Branco - Séries Temporais,Estatística para Concurso,0.10300000000000001,,9,2,2017,YouTube,https://www.youtube.com/watch?v=y5CIwS9KIIk,https://i.ytimg.com/vi/y5CIwS9KIIk/maxresdefault.jpg,1280,720,"Análise Epectral e Modelos ARIMA - Ruído - Conhecendo as Características do Ruído Branco: função de autocovariância, autocorrelação e a densidade espectral. ...",video.other,função autocovariancia,5320.0
169,Complete Road Map To Prepare For Deep Learning🔥🔥🔥🔥,Krish Naik,3.0,,1,10,2020,YouTube,https://www.youtube.com/watch?v=9jA0KjS7V_c,https://i.ytimg.com/vi/9jA0KjS7V_c/maxresdefault.jpg,1280,720,In this video I am going to discuss about the complete road map to prepare for deep learning which will be definitely helpful for preparing for interviewsCom...,video.other,Learn deep learning Python,73532.0
250,Entenda o Básico de Redes Neurais em 5 minutos! Zona de Dados #3,Vini Mesel - #MaisQueDevs,1.7000000000000002,,6,6,2017,YouTube,https://www.youtube.com/watch?v=t1IMY6kEetw,https://i.ytimg.com/vi/t1IMY6kEetw/maxresdefault.jpg,1280,720,Neste vídeo Vinicius Mesel dá uma explicação rápida sobre o que é uma rede neural.==================== Links Importantes =================== Twitter: http://...,video.other,DNNs,104401.0
98,Aula 15/2020 - Redes Neurais Recorrentes,Escola Livre de Inteligência Artificial,,,8,9,2020,YouTube,https://www.youtube.com/watch?v=CTMZjdbP6Bg,https://i.ytimg.com/vi/CTMZjdbP6Bg/hqdefault.jpg,480,360,Professor Victor VenitesLinkedin: https://www.linkedin.com/in/victor-venites/A Escola Livre de IA oferece aulas gratuitas sobre Inteligência Artificial e nes...,video.other,,63084.0
619,What are Transformers (Machine Learning Model)?,IBM Technology,2.0,,11,3,2022,YouTube,https://www.youtube.com/watch?v=ZXiruGOCn9s,https://i.ytimg.com/vi/ZXiruGOCn9s/maxresdefault.jpg,1280,720,Learn more about Transformers → http://ibm.biz/ML-TransformersLearn more about AI → http://ibm.biz/more-about-aiCheck out IBM Watson → http://ibm.biz/more-ab...,video.other,Artificial Intelligence,17080.5
559,Summary and Legacy of the Smartphone Decimeter Challenge (SDC) 2022 | Kaggle,Kaggle,0.034,,28,9,2022,YouTube,https://www.youtube.com/watch?v=yjhnmu8lmY0,https://i.ytimg.com/vi/yjhnmu8lmY0/hqdefault.jpg?sqp=-oaymwEmCOADEOgC8quKqQMa8AEB-AH-CYAC0AWKAgwIABABGBIgXihyMA8=&rs=AOn4CLAFgQwnhDliL-_nqQb5Ou7x36tnmw,480,360,"Michael Fu, Mohammed Khider, and Frank van Diggelen share their biggest takeaways from the winning solutions & participants of the Google Smartphone Decimete...",video.other,CS,11131.0
307,INTELIGÊNCIA ARTIFICIAL na PRÁTICA #09: rede neural recorrente para séries temporais com “keras”,Terra das Exatas,0.036000000000000004,,29,9,2022,YouTube,https://www.youtube.com/watch?v=FrNJy19s1QI,https://i.ytimg.com/vi/FrNJy19s1QI/maxresdefault.jpg,1280,720,Códigos:https://github.com/TerradasExatas/IA_e_Machine_Learning/blob/main/IA_NN_Recorrente_series_temporais.ipynbNeste vídeo continuamos a estudar o aprendiz...,video.other,,1627.0
430,O QUE É A INTELIGÊNCIA ARTIFICIAL (AI)?,Minutos Psíquicos,8.6,1.6,31,8,2017,YouTube,https://www.youtube.com/watch?v=UhA_ZgI-otM,https://i.ytimg.com/vi/UhA_ZgI-otM/maxresdefault.jpg,1280,720,"Hoje falaremos sobre inteligência artificial, algoritmos, robôs e como tudo isso vai impactar cada vez mais os nossos cotidianos nas próximas décadas.Agradec...",video.other,Futuro,232889.0
152,Como Instalar O Tensorflow Com Cuda (GPU Para Deep Learning),Código Logo,0.024,,9,1,2023,YouTube,https://www.youtube.com/watch?v=eFyJckFQG9o,https://i.ytimg.com/vi/eFyJckFQG9o/maxresdefault.jpg,1280,720,Neste vídeo vou mostrar como instalar o TensorFlow com suporte a GPU utilizando o CUDA (Compute Unified Device Architecture). O CUDA é uma arquitetura de com...,video.other,deep learning gpu,1723.0
638,"[STATA] Multicolinearidade, Heterocedasticidade e Autocorrelação",economiaetv,0.789,,16,11,2011,YouTube,https://www.youtube.com/watch?v=UOHxeacprBo,https://i.ytimg.com/vi/UOHxeacprBo/maxresdefault.jpg,1280,720,"➡️ CONSULTORIA, ASSESSORIA ACADÊMICA E PARCERIAS: economiaetv@gmail.com.➡️ CURSO: INTRODUÇÃO A MODELOS DE REGRESSÃO: TEORIA E APLICAÇÃO *https://forms.gle/rJ...",video.other,Stata,8165.0
382,MIT 6.S191 (2022): Reinforcement Learning,Alexander Amini,,,8,4,2022,YouTube,https://www.youtube.com/watch?v=-WbN61qtTGQ,https://i.ytimg.com/vi/-WbN61qtTGQ/maxresdefault.jpg,1280,720,"MIT Introduction to Deep Learning 6.S191: Lecture 5Deep Reinforcement LearningLecturer: Alexander AminiJanuary 2022For all lectures, slides, and lab material...",video.other,alphazereo,30557.0
417,NÃO faça o curso da Google de Análise de Dados antes de ver esse vídeo - 8 motivos,Carreira Analítica,0.096,,12,4,2023,YouTube,https://www.youtube.com/watch?v=SwTpmr36cvo,https://i.ytimg.com/vi/SwTpmr36cvo/maxresdefault.jpg,1280,720,📊 Formação Oficial da Google para Análise de Dados (Português):https://imp.i384100.net/EaMgY9NÃO faça o curso da Google de Análise de Dados antes de ver e...,video.other,analista de dados por onde começar,1361.5
518,REDES NEURAIS ARTIFICIAIS,Núcleo de Produção Desenvolvimento Acadêmico,0.028,,27,10,2017,YouTube,https://www.youtube.com/watch?v=hzr-APJxaIs,https://i.ytimg.com/vi/hzr-APJxaIs/maxresdefault.jpg,1280,720,Aprendizagem de MáquinaProf. Dr. Leandro Nunes de CastroFACULDADE DE COMPUTAÇÃO E INFORMÁTICA MACKENZIE - 2017,video.other,,28734.0
513,Questão de SQL  - Controle de Passes de Metrô CESGRANRIO - Concurso Banco do Brasil,Arnaldo Junior,0.069,,24,3,2023,YouTube,https://www.youtube.com/watch?v=Z7q2NWgnm7I,https://i.ytimg.com/vi/Z7q2NWgnm7I/maxresdefault.jpg,1280,720,"Questão de 2022 sobre SQL da banca CESGRANRIO, para o concurso da ELETROBRAS-ELETRONUCLEAR, para o cargo Analista de Sistemas. No site do Qconcursos, mais de...",video.other,,1235.0
635,[Hello Bot 2.0] Mentoria ao vivo - IA Conversacional vs IA Generativa CHATGPT,Letsbot,,,6,4,2023,YouTube,https://www.youtube.com/watch?v=A-J1y_zA4-Y,https://i.ytimg.com/vi/A-J1y_zA4-Y/maxresdefault.jpg,1280,720,Domine a IA e transforme a sua carreira!• Formação multidisciplinar e especialista• Programa acompanhado de 3 meses e um ano de acesso total• Mentorias seman...,video.other,,2505.0
528,Redes Neurais Artificiais - Um breve conceito,Cassio Groh,0.217,,20,3,2017,YouTube,https://www.youtube.com/watch?v=rO3W36-TdjM,https://i.ytimg.com/vi/rO3W36-TdjM/hqdefault.jpg,480,360,Trabalho sobre redes neurais artificiais desenvolvido para obtenção parcial de notas na disciplina de Análise e Simulação de Processos do 7º período do curso...,video.other,,13428.5
245,Engenharia de Dados: O que faz? Como se tornar? Quanto ganha?,Dev John,,,24,3,2021,YouTube,https://www.youtube.com/watch?v=RRnDDlN0nvc,https://i.ytimg.com/vi/RRnDDlN0nvc/maxresdefault.jpg,1280,720,Engenharia de Dados é uma profissão que está em constante crescimento Nos últimos anos. Por causa da geração massiva de dados e das culturas data-driven dent...,video.other,engenheiro de dados curso,15084.0
70,Aplicações em aprendizado de máquina - Introdução ao aprendizado de máquina,UNIVESP,0.157,1.2,9,5,2022,YouTube,https://www.youtube.com/watch?v=TY45HIJ3RpM,https://i.ytimg.com/vi/TY45HIJ3RpM/maxresdefault.jpg,1280,720,univesp.brAplicações em aprendizado de máquina Univesp (Universidade Virtual do Estado de São Paulo)Professor: Cristhof Johann Roosen Runge,video.other,Cristhof Johann Roosen Runge.,2550.0
260,FORMATION DEEP LEARNING COMPLETE (2021),Machine Learnia,26.0,,25,4,2021,YouTube,https://www.youtube.com/watch?v=XUFLq6dKQok,https://i.ytimg.com/vi/XUFLq6dKQok/maxresdefault.jpg,1280,720,"Cette formation sur le Deep Learning vous apprendra à développer des réseaux de neurones artificiels, en voyant tous les détails mathématiques qui se cachent...",video.other,cds,189340.0
464,O que é Machine Learning? #HipstersPontoTube,Alura,12.0,,22,4,2019,YouTube,https://www.youtube.com/watch?v=Iuz_jc96bQk,https://i.ytimg.com/vi/Iuz_jc96bQk/maxresdefault.jpg,1280,720,"Como as máquinas aprendem? Antes disso, temos de nos perguntar como é que nós humanos aprendemos. Assista à explicação dos irmãos Silveira! 💻 Conheça nossa ...",video.other,redes bayesianas,311139.0
365,LINGUAGEM NEUTRA NAS ESCOLAS | com Dennys Xavier e Fábio Gomes,Brasil Paralelo,,3.4,12,4,2023,YouTube,https://www.youtube.com/watch?v=vpp_nFM-uU0,https://i.ytimg.com/vi/vpp_nFM-uU0/maxresdefault.jpg,1280,720,"Um novo projeto, ousado e desafiador, será revelado ao público na próxima quinta-feira (13). Cadastre-se para saber mais: https://sitebp.la/cbp-ytc__________...",video.other,fabio gomes,34252.0
306,INTELIGÊNCIA ARTIFICIAL e o DESTINO DA HUMANIDADE I Documentário,Mundo Proibido,7.3,1.0,31,5,2021,YouTube,https://www.youtube.com/watch?v=e-TZ8HaHDWA,https://i.ytimg.com/vi/e-TZ8HaHDWA/maxresdefault.jpg,1280,720,Nossa humanidade presencia o nascimento de uma nova civilização. Nossas crianças já nascem “conectadas” e interdependentes dessas novas tecnologias. A “inter...,video.other,mundo proibido,145823.0
95,Aula 1 - Disciplina Machine Learning para Predições em Saúde (EPI5717),Laboratório Labdaps USP,0.41300000000000003,,2,9,2021,YouTube,https://www.youtube.com/watch?v=0G3GN2su2Mc,https://i.ytimg.com/vi/0G3GN2su2Mc/maxresdefault.jpg,1280,720,Disciplina de inteligência artificial da pós-graduação da Faculdade de Saúde Pública da USP ministrada pelo Prof. Alexandre Chiavegatto Filho.Acompanhe o LAB...,video.other,,2260.0
549,Scikit-optimize for LightGBM Tutorial with Luca Massaron | Kaggle's #30daysofML 2021,Kaggle,0.192,,20,10,2021,YouTube,https://www.youtube.com/watch?v=AFtjWuwqpSQ,https://i.ytimg.com/vi/AFtjWuwqpSQ/maxresdefault.jpg,1280,720,SUBSCRIBE: https://www.youtube.com/c/kaggle?sub_confirmation=1&utm_medium=youtube&utm_source=channel&utm_campaign=yt-subAbout Kaggle:Kaggle is the world's la...,video.other,CS,310146.0
49,AI vs Machine Learning,IBM Technology,1.4,,10,4,2023,YouTube,https://www.youtube.com/watch?v=4RixMPF4xis,https://i.ytimg.com/vi/4RixMPF4xis/maxresdefault.jpg,1280,720,What is Artificial Intelligence (AI)? → https://ibm.biz/defining-aiWhat is Machine Learning? →  https://ibm.biz/defining-MLWhat is really the difference betw...,video.other,deeplearning,498914.5
24,6 Months Data Science RoadMap 2023,Krish Naik,2.8,,7,1,2023,YouTube,https://www.youtube.com/watch?v=NWzbdWf7Yts,https://i.ytimg.com/vi/NWzbdWf7Yts/maxresdefault.jpg,1280,720,Github Roadmap: https://github.com/krishnaik06/6-Months-Data-Science-Roadmap-We at PW Skills are happy to announce below Data Science BatchBest Affordable Da...,video.other,krish naik machine learning tutorials,59636.0
573,Teoria sobre Redes Neurais Artificiais: cálculos passo a passo Perceptron,IA Expert Academy,0.224,,3,5,2022,YouTube,https://www.youtube.com/watch?v=0chlwnUKoHA,https://i.ytimg.com/vi/0chlwnUKoHA/maxresdefault.jpg,1280,720,"Nessa videoaula você será apresentado a teoria sobre cálculos passo a passo Perceptron das redes neurais artificiais. A aula faz parte do curso ""Algoritmos d...",video.other,#inteligenciaartificial,1184.0
570,TOP 7 Livros de DATA SCIENCE para 2023,Carlos Melo,0.214,,14,,2022,YouTube,https://www.youtube.com/watch?v=i8qXW0zdtew,https://i.ytimg.com/vi/i8qXW0zdtew/maxresdefault.jpg,1280,720,Esses são os 7 livros para você aprender Data Science e se diferenciar no mercado de trabalho em 2023.OS 7 MELHORES LIVROS para aprender DATA SCIENCE em 2023...,video.other,cursos de data science,10396.0
522,Reconhecimento de Imagens com Deep Learning usando TensorFlow e Keras // Mão no Código by Red Hat #8,Código Fonte TV,1.1,,17,9,2021,YouTube,https://www.youtube.com/watch?v=7MItgjXU3_E,https://i.ytimg.com/vi/7MItgjXU3_E/maxresdefault.jpg,1280,720,"Cachorro ou Gato? Criar um modelo de Inteligência Artificial para fazer classificação de fotos pode parecer trivial, mas envolve muita tecnologia e aprendiza...",video.other,YoutubeBrasil,7164.0
454,O que é Ciência de Dados? |📎 Zup Clipes ✂️,Zup,,,26,10,2022,YouTube,https://www.youtube.com/watch?v=J63YHIeI1oc,https://i.ytimg.com/vi/J63YHIeI1oc/maxresdefault.jpg,1280,720,"E aí, você já pensou o que é ciência de dados? Durante o Zup Open Talks, a Fabiane Nardon apresentou um painel sobre o tema, que relaciona big data, estatíst...",video.other,o que é ciência de dados,14303.5
191,"Data Analyst vs Data Scientist - What's the Difference? | Role, Skills, Salary & Demand",WsCube Tech,1.1,2.23,30,1,2023,YouTube,https://www.youtube.com/watch?v=w0eeQ0Tgk7E,https://i.ytimg.com/vi/w0eeQ0Tgk7E/maxresdefault.jpg,1280,720,"In this video, learn about Data Analyst vs Data Scientist - What's the Difference? | Role, Skills, Salary & DemandData Analysts and Data Scientists both work...",video.other,data analyst job,5371.0
213,Deep Learning - Redes Neurais Convolucionais,Hemerson Pistori,0.986,,17,4,2017,YouTube,https://www.youtube.com/watch?v=DXnyuUZcAAI,https://i.ytimg.com/vi/DXnyuUZcAAI/maxresdefault.jpg,1280,720,Neste vídeo eu busco explicar o que é a convolução dentro deste contexto das redes neurais convolucioais. Também falo de alguns outros aspectos deste tipo de...,video.other,aprendizado profundo,1932.0
354,Intuition Behind Self-Attention Mechanism in Transformer Networks,Ark,2.5,,16,10,2020,YouTube,https://www.youtube.com/watch?v=g2BRIuln4uc,https://i.ytimg.com/vi/g2BRIuln4uc/hqdefault.jpg,480,360,"This is the first part of the Transformer Series. Here, I present an intuitive understanding of the self-attention mechanism in transformer networks.[Paper] ...",video.other,NLP,35970.0
221,Desafio Kaggle: Titanic - Preparando os dados - Parte 1,DevVerso \\x5bBR\\x5d,0.152,,22,4,2022,YouTube,https://www.youtube.com/watch?v=8Fu-jBoPci0,https://i.ytimg.com/vi/8Fu-jBoPci0/maxresdefault.jpg,1280,720,Neste vídeo iremos fazer juntos uma análise exploratória e a preparação dos dados do desafio do Titanic do site Kaggle antes de iniciar a construção dos mode...,video.other,list comprehensions,849.5
173,Concurso Banco do Brasil | Agente de Tecnologia – TI Aprendizagem de máquina: Prof. Jósis Alves,Gran Cursos Online,,2.09,14,7,2021,YouTube,https://www.youtube.com/watch?v=kj3uJXbNFS4,https://i.ytimg.com/vi/kj3uJXbNFS4/maxresdefault.jpg,1280,720,🔊 A Grande Retomada: Aproveite o MAIOR DESCONTO da nossa história.  🖱 ➡ https://www.grancursosonline.com.br/assinatura-ilimitadaEstude Aprendizagem de máqu...,video.other,maratona banco do brasil,2550.0
334,Introdução a modelos de séries temporais (parte 1/2),economiaetv,0.156,,30,9,2020,YouTube,https://www.youtube.com/watch?v=ICY8gVN1ctc,https://i.ytimg.com/vi/ICY8gVN1ctc/maxresdefault.jpg,1280,720,"➡️ CONSULTORIA, ASSESSORIA ACADÊMICA E PARCERIAS: economiaetv@gmail.com.➡️ CURSO: INTRODUÇÃO A MODELOS DE REGRESSÃO: TEORIA E APLICAÇÃO *https://forms.gle/rJ...",video.other,,2318.0
267,GPT3: An Even Bigger Language Model - Computerphile,Computerphile,11.0,2.2800000000000002,1,7,2020,YouTube,https://www.youtube.com/watch?v=_8yVOC4ciXc,https://i.ytimg.com/vi/_8yVOC4ciXc/maxresdefault.jpg,1280,720,"Basic mathematics from a language model? Rob Miles on GPT3, where it seems like size does matter!More from Rob Miles: http://bit.ly/Rob_Miles_YouTube   https...",video.other,Machine Learning,176771.0
615,What Is Data Engineering | Data Engineering Explained | How To Become A Data Engineer | Intellipaat,Intellipaat,,1.6,17,5,2022,YouTube,https://www.youtube.com/watch?v=bWIZqtlcnnY,https://i.ytimg.com/vi/bWIZqtlcnnY/maxresdefault.jpg,1280,720,🔵  Intellipaat Data Engineering course: https://intellipaat.com/pgp-data-engineering-mit-job-guarantee/#WhatIsDataEngineering #DataEngineeringExplained #How...,video.other,Intellipaat,20580.0
2,#1 - Data Science na Prática - Conhecendo o Kaggle,Data Train,,,3,8,2020,YouTube,https://www.youtube.com/watch?v=ui8o6ZTSd0I,https://i.ytimg.com/vi/ui8o6ZTSd0I/maxresdefault.jpg,1280,720,Neste vídeo conheceremos a maior plataforma de competição de Data Science e Machine Learning existente.Acesse o site da comunidade Data Train:http://datatrai...,video.other,,336.0
286,How I Would NOT Learn Data Science in 2023.,Ken Jee,3.5,,3,1,2023,YouTube,https://www.youtube.com/watch?v=t6CD1EwU5kc,https://i.ytimg.com/vi/t6CD1EwU5kc/maxresdefault.jpg,1280,720,#DataScience #KenJee In this video I talk about how I would not learn data science in 2023. I take a look at the 7 traps that data science learners fall into...,video.other,data analysis,25443.5
660,🤯 10 NOVAS Ferramentas de IA Que Vão EXPLODIR SUA MENTE (IMPERDÍVEL!),Rob Boliver - Como usar o CANVA,4.3,,6,4,2023,YouTube,https://www.youtube.com/watch?v=prhC71vEprI,https://i.ytimg.com/vi/prhC71vEprI/maxresdefault.jpg,1280,720,"No vídeo de hoje eu mostro 10 ferramentas de inteligência artificial que vão EXPLODIR a sua mente, e você vai sair correndo para usar. — ⚠️ LINKS IMPORTANTES...",video.other,produtividade online,363258.0
170,Computer evolves to generate baroque music!,carykh,64.0,,9,3,2017,YouTube,https://www.youtube.com/watch?v=SacogDL_4JU,https://i.ytimg.com/vi/SacogDL_4JU/maxresdefault.jpg,1280,720,"I put the word ""evolve"" in there because you guys like ""evolution"" videos, but this computer is actually learning with gradient descent!EDIT FROM 2021-05-13:...",video.other,karpathy,1704433.0
500,"Python - Análise de Séries Temporais - Média Móvel, Sazonalidade e Tendência",Bruno Lima - PBIx,0.152,,2,1,2022,YouTube,https://www.youtube.com/watch?v=zytWn0cBiIU,https://i.ytimg.com/vi/zytWn0cBiIU/maxresdefault.jpg,1280,720,"Fala turma, no vídeo de hoje vamos fazer uma introdução de analises temporárias em Python.Se gostou do vídeo deixe seu like e se inscreva no canal.",video.other,média móvel,184.0
641,[Twitch] Projeto Data Science do Zero - Parte I,Téo Calvo,0.462,,8,3,2020,YouTube,https://www.youtube.com/watch?v=6CoM665ZoKA,https://i.ytimg.com/vi/6CoM665ZoKA/maxresdefault.jpg,1280,720,Dando início à um projeto de Data Science do Zero.Nesta live criamos visão de cliente CRM. Da mesma forma que muitas empresas fazem para ter visibilidade dos...,video.other,reallife,2042.0
331,Introdução a Redes Neurais Convolucionais,Escola de Inteligência Artificial,0.08,,30,3,2020,YouTube,https://www.youtube.com/watch?v=ALiI4pRPeBs,https://i.ytimg.com/vi/ALiI4pRPeBs/hqdefault.jpg,480,360,Este Vídeo Faz parte do Curso Formação Engenheiro de Deep Learning. Para saber mais acesse https://www.udemy.com/course/engenheiro-de-deep-learning/?referral...,video.other,Inteligência Artificial,13327.125
81,As Mentiras que te Contam sobre Ciências de Dados,Jerry Strazzeri,2.9,,13,7,2021,YouTube,https://www.youtube.com/watch?v=ecdpcXwP8m8,https://i.ytimg.com/vi/ecdpcXwP8m8/maxresdefault.jpg,1280,720,As Mentiras que te Contam sobre Ciências de Dados. Quais são as maiores mentiras para quem esta procurando entrar na área de dados.🎯 Mais informações sobre ...,video.other,,20445.666666666668
284,How Data Engineering Works,AltexSoft,14.0,,17,3,2021,YouTube,https://www.youtube.com/watch?v=qWru-b6m030,https://i.ytimg.com/vi/qWru-b6m030/maxresdefault.jpg,1280,720,"So, the sole purpose of data engineering is to take data from the source and save it to make it available for analysis. Sounds simple, but it’s the matter of...",video.other,hadoop,33796.0
438,O melhor site de inteligencia artificial ( o que é e como funciona o Chat GPT),Carreira Analítica,0.129,,23,,2022,YouTube,https://www.youtube.com/watch?v=vCcorz3JkVA,https://i.ytimg.com/vi/vCcorz3JkVA/maxresdefault.jpg,1280,720,O melhor site de inteligencia artificial ( o que é e como funciona o Chat GPT)chat.openai.comCurso Oficial da Google para Análise de Dados:Português: https:/...,video.other,aprendizado de máquina,1539.0
