,titulo,nome_canal,likes_video_(em_milhares),inscritos_canal_(em_milhoes),dia,mes,ano,nome_site,url,imagem,largura_imagem,altura_imagem,descricao,tipo,tags,visualizacoes
581,Tipos de Gráficos - Tipos de Gráficos Estatísticos - Básico,Pedro Tartuci,3.2,,12,5,2017,YouTube,https://www.youtube.com/watch?v=eS7wYUc7ZjM,https://i.ytimg.com/vi/eS7wYUc7ZjM/maxresdefault.jpg,1280,720,"Uma da áreas da matemática que eu mais gosto de ensinar é a Estatística. E dentro dela, temos a aula: Tipos de Gráficos - Tipos de Gráficos Estatísticos. Eu ...",video.other,mediana,144499.0
142,Cientista de Dados - Por Onde Começar?,Jerry Strazzeri,1.6,,17,10,2020,YouTube,https://www.youtube.com/watch?v=fFLtY_11nqs,https://i.ytimg.com/vi/fFLtY_11nqs/maxresdefault.jpg,1280,720,Cientista de Dados - Por Onde Começar ?Informações sobre Data Science e Analytics - https://23619875.hs-sites.com/mdaInstagram: https://www.instagram.com/jer...,video.other,,485164.0
530,Redes Neurais Convolucionais - o básico,Diego Silva,0.11,,24,3,2021,YouTube,https://www.youtube.com/watch?v=ChVTw0T88Eo,https://i.ytimg.com/vi/ChVTw0T88Eo/maxresdefault.jpg?sqp=-oaymwEmCIAKENAF8quKqQMa8AEB-AHUBoAC4AOKAgwIABABGGUgZShlMA8=&rs=AOn4CLB4QSlygZ2jeCRatQbl-bUyFxGqFA,1280,720,"Nessa aula, eu explico o que é uma rede neural convolucional (convolutional neural network, CNN). Apresento os princiapis conceitos e mostro, na prática, com...",video.other,,436.0
494,Prevendo preços no Mini Índice com LSTM (arquitetura de rede neural recorrente - RNN em python),Aprenda a programar,0.068,,15,6,2022,YouTube,https://www.youtube.com/watch?v=66U7Pj9Hhbk,https://i.ytimg.com/vi/66U7Pj9Hhbk/maxresdefault.jpg?sqp=-oaymwEmCIAKENAF8quKqQMa8AEB-AH-CYAC0AWKAgwIABABGE8gYChlMA8=&rs=AOn4CLAN80UoGBvSzE6DAdi9-TGjebjCBQ,1280,720,Baixe o gradiente nos links dos vídeos anteriores! Logo novas versões estarão disponíveis juntamente com indicadores personalizados!Link para baixar a versão...,video.other,stockprediction,636.0
422,O Fim do Dólar Está se Aproximando? EUA X CHINA,Convex Research,0.126,,11,4,2023,YouTube,https://www.youtube.com/watch?v=KusNlfViCQA,https://i.ytimg.com/vi/KusNlfViCQA/maxresdefault.jpg,1280,720,"Neste vídeo tratamos do papel do dólar no sistema financeiro, as mudanças dos últimos anos, geopolítica, reservas internacionais, controle de capitais e como...",video.other,stock,2719766.0
227,EM 7 ANOS ISSO ACONTECERÁ - INTELIGÊNCIA ARTIFICIAL / ChatGPT,Rutã,1.4,1.4,12,4,2023,YouTube,https://www.youtube.com/watch?v=kVvgi-sLT04,https://i.ytimg.com/vi/kVvgi-sLT04/maxresdefault.jpg,1280,720,"Há preocupações entre algumas pessoas em relação a um possível apocalipse da inteligência artificial (IA). No entanto, é importante notar que esses cenários ...",video.other,como usar chatgpt,296077.0
481,PARA TUDO! ELON MUSK QUER PAUSAR A REVOLUÇÃO DAS IA's,Nerds de Negócios,36.0,2.8,31,3,2023,YouTube,https://www.youtube.com/watch?v=17NVPlsd_dk,https://i.ytimg.com/vi/17NVPlsd_dk/maxresdefault.jpg,1280,720,"✓ APRENDA A GANHAR DINHEIRO SEM SAIR DE CASA HOJE MESMO! CONHEÇA A CYBERCLASS: http://bit.ly/3U7uQaDPediu pra parar, parou? Ninguém menos que Elon Musk, um d...",video.other,poupar,620709.0
196,Data Engineering Principles - Build frameworks not pipelines - Gatis Seja,PyData,3.1,,9,4,2019,YouTube,https://www.youtube.com/watch?v=pzfgbSfzhXg,https://i.ytimg.com/vi/pzfgbSfzhXg/maxresdefault.jpg,1280,720,"PyData London Meetup #54Tuesday, March 5, 2019Data pipelines are necessary for the flow of information from its source to its consumers, typically data scien...",video.other,python 3,68755.0
113,CCDD 001 - Modelo de Projeto,Ignorância Zero,,,1,2,2022,YouTube,https://www.youtube.com/watch?v=SQC72xQ2U6Q,https://i.ytimg.com/vi/SQC72xQ2U6Q/maxresdefault.jpg,1280,720,"Uma visão geral sobre o dia a dia de um cientista de dados, com as várias cerimônias e responsabilidades que o mesmo tem, para prepara-los pra como as várias...",video.other,análise de dados,1922.0
578,The Projects You Should Do To Get A Data Science Job,Ken Jee,5.6,,29,7,2019,YouTube,https://www.youtube.com/watch?v=yukdXV9LR48,https://i.ytimg.com/vi/yukdXV9LR48/maxresdefault.jpg,1280,720,In this video I talk about what makes a good data science project. I also go into the 6 different types of projects that I recommend for learning data scienc...,video.other,deep learning,74738.0
425,O Mercado de Data Science no Brasil,Jerry Strazzeri,0.33,,4,3,2023,YouTube,https://www.youtube.com/watch?v=h1c8mxbs5fY,https://i.ytimg.com/vi/h1c8mxbs5fY/maxresdefault.jpg?sqp=-oaymwEmCIAKENAF8quKqQMa8AEB-AH-CYAC0AWKAgwIABABGGUgSShKMA8=&rs=AOn4CLDXkoCOSfBXmNzvd9jbq_q8KPc2NQ,1280,720,Entenda como funciona o mercado de Data Science no Brasil e como conseguir um emprego nesta área com alytos salários,video.other,,276544.6666666667
36,A TRETA DO ANIME FEITO POR INTELIGÊNCIA ARTIFICIAL,Cenário Transparente,23.0,,30,3,2023,YouTube,https://www.youtube.com/watch?v=362YF15BFio,https://i.ytimg.com/vi/362YF15BFio/maxresdefault.jpg,1280,720,Contato profissional: cenariotransparentecontato@gmail.comJogo: Dome KeeperServer do Discord: https://discord.gg/SKBJheM3vjRedes sociais:Perecini: https://ww...,video.other,noticia anime,147449.5
249,Entenda de uma vez por todas quais são as principais tecnologias usadas em Data Engineering,Stack,0.191,,26,1,2022,YouTube,https://www.youtube.com/watch?v=3VINnfZGKHs,https://i.ytimg.com/vi/3VINnfZGKHs/hqdefault.jpg,480,360,"Neste vídeo eu falo sobre as principais tecnologias que envolvem Data Engineering e para que serve cada uma delas.**Código fonte**: '#dataengineering, #datas...",video.other,#dados,871.0
423,O Futuro dos Programadores Jr.,Código Fonte TV,8.6,,16,3,2023,YouTube,https://www.youtube.com/watch?v=Opy6W57iXfo,https://i.ytimg.com/vi/Opy6W57iXfo/maxresdefault.jpg,1280,720,"Será que os Programadores Jr irão desaparecer? A barreira de entrada para desenvolvedores novos é repleta de desafios, mas não são intransponíveis. É possíve...",video.other,Estágio,299841.0
207,Deep Focus Music To Improve Concentration - 12 Hours of Ambient Study Music to Concentrate #464,4K Video Nature - Focus Music,,,9,4,2023,YouTube,https://www.youtube.com/watch?v=qiNWZyKmJfA,https://i.ytimg.com/vi/qiNWZyKmJfA/maxresdefault.jpg,1280,720,Deep Focus Music To Improve Concentration - 12 Hours of Ambient Study Music to Concentrate #464  Enjoy these 12 of deep focus music to improve concentration ...,video.other,deep focus music,18155.0
116,COMO A CIÊNCIA DE DADOS PODE AJUDAR NO MARKETING DIGITAL,Eduardo | Ciência dos Dados,0.008,,6,4,2023,YouTube,https://www.youtube.com/watch?v=AYdvROjIEl0,https://i.ytimg.com/vi/AYdvROjIEl0/maxresdefault.jpg,1280,720,Quero te fazer um convite!Se você deseja ganhar de 5 a 12 mil como Cientista de Dados Profissional eu quero te convidar pra live de hoje às 20:00H.Simbóra CD...,video.other,,53702.5
313,Inteligencia Artificial Generativa Tecnología de Alto Impacto Global,Observatorio Tecnológico de Hidalgo UAEH,0.011,,9,1,2023,YouTube,https://www.youtube.com/watch?v=n0glDYm2ZE0,https://i.ytimg.com/vi/n0glDYm2ZE0/maxresdefault.jpg,1280,720,,video.other,,1374.0
361,Kaggle's 30 Days Of ML (Day-1): Getting Started With Kaggle,Abhishek Thakur,,,3,8,2021,YouTube,https://www.youtube.com/watch?v=_55G24aghPY,https://i.ytimg.com/vi/_55G24aghPY/maxresdefault.jpg,1280,720,"This video is a walkthrough of Kaggle's #30DaysOfML. In this video, we create a #Kaggle account, learn what upvotes and comments are, and make our first subm...",video.other,30daysofml day 1,15741.0
203,"Data scientist, Data Engineer : Pourquoi ces métiers s’hyper spécialisent?",Data From Scratch - Willis,0.084,,11,4,2023,YouTube,https://www.youtube.com/watch?v=DDPF3GxXz3k,https://i.ytimg.com/vi/DDPF3GxXz3k/maxresdefault.jpg,1280,720,"Nouvelle vidéo : Data scientist, Data Engineer : Pourquoi ces métiers s’hyper spécialisent?Coaching en Data Engineering : https://calendly.com/willis-nanaCad...",video.other,,7595.0
222,Desafio de dados com prêmio de CEM MIL DÓLARES no Kaggle | Handshake #2,Programação Dinâmica,0.405,,24,7,2019,YouTube,https://www.youtube.com/watch?v=WycZXyscLzg,https://i.ytimg.com/vi/WycZXyscLzg/maxresdefault.jpg,1280,720,"Um site com competições de machine learning e milhares de dólares em prêmios? É isso mesmo!Nesse vídeo, Kizzy apresenta a Kaggle,  uma comunidade on-line de ...",video.other,svm,2290.5
296,How to tell if a career in Data Analytics is right for you...,CareerFoundry,5.5,,16,9,2022,YouTube,https://www.youtube.com/watch?v=NOJKAzIH8hA,https://i.ytimg.com/vi/NOJKAzIH8hA/maxresdefault.jpg,1280,720,"Interested to start your own journey into data analytics? Get started today with CareerFoundry's free data analytics short course, sign up at the following l...",video.other,data analytics interview,15935.5
20,3rd R Day - Tutorial: Implementando modelos estatísticos de maneira eficiente com o TMB,LEG UFPR,0.012,,10,9,2021,YouTube,https://www.youtube.com/watch?v=a1XfzEow6Hc,https://i.ytimg.com/vi/a1XfzEow6Hc/maxresdefault.jpg?sqp=-oaymwEmCIAKENAF8quKqQMa8AEB-AHUBoAC4AOKAgwIABABGGUgZShlMA8=&rs=AOn4CLCFlBeflG2F9mytXIe_TGs8G1J0cA,1280,720,O Template Model Builder (TMB) é um pacote R que possibilita o ajuste de complexos modelos estatísticos de efeito aleatório. Diferente da maioria dos pacotes...,video.other,,398.0
424,O MISTÉRIO SOBRE A TAXA DE EXPANSÃO DO UNIVERSO CONTINUA APÓS NOVO CÁLCULO ALTAMENTE PRECISO,Ciência News,0.47600000000000003,,9,4,2023,YouTube,https://www.youtube.com/watch?v=Qg79yWdAh0k,https://i.ytimg.com/vi/Qg79yWdAh0k/maxresdefault.jpg,1280,720,#universeexpansion #Hubblesconstant #hubblelaw #bigbang #ciencianews Disagreement Over The Expansion Rate Of The Universe Is Worse Than EverThe two main meth...,video.other,#universeexpansion #Hubblesconstant #hubblelaw #bigbang #ciencianews,1187427.0
342,Introdução à Arquitetura de Dados - Parte 1 (Overview),Escola de Inteligência Artificial,0.125,,2,7,2021,YouTube,https://www.youtube.com/watch?v=s_WjOFW7-zE,https://i.ytimg.com/vi/s_WjOFW7-zE/maxresdefault.jpg,1280,720,Nada é mais importante hoje em dia no mundos dos negócios e das startups do que fazer bom uso dos dados. Neste vídeo você vai entender o que é Arquitetura de...,video.other,,1461.0
255,Estatística - séries estatísticas - tipos de séries,Matusalém Vieira Martins,0.338,,3,6,2015,YouTube,https://www.youtube.com/watch?v=b8Fcl9VU7rI,https://i.ytimg.com/vi/b8Fcl9VU7rI/hqdefault.jpg,480,360,"dados relativos e dados absolutos, índices, coeficientes e taxas",video.other,Séries Estatísticas,367809.5
571,TSE UNIFICADO | não escolha seu TRE sem ver este vídeo!!!,Volts - Concursos Públicos,0.163,,13,4,2023,YouTube,https://www.youtube.com/watch?v=JULfGws2ue0,https://i.ytimg.com/vi/JULfGws2ue0/maxresdefault.jpg,1280,720,Link para o curso do Método Volts:https://pay.hotmart.com/V27567800D?bid=1669057218824Seja membro deste canal e ganhe benefícios:https://www.youtube.com/chan...,video.other,TSE unificado,10553.0
531,Redes Neurais Convolucionais com PyTorch | Visão Computacional | Deep Learning #2,Programação Dinâmica,,,16,10,2021,YouTube,https://www.youtube.com/watch?v=doT7koXt9vw,https://i.ytimg.com/vi/doT7koXt9vw/maxresdefault.jpg,1280,720,✅ Ainda precisa aprender a programar? Aprenda Python do Jeito Certo e desenvolva uma base fundamental para se tornar capaz de pensar e criar soluções para pr...,video.other,aprendizado de maquina,19991.0
318,Inteligência Artificial destruindo no dinossauro da Google! (Rede Neural),Universo Programado,210.0,,30,1,2019,YouTube,https://www.youtube.com/watch?v=NZlIYr1slAk,https://i.ytimg.com/vi/NZlIYr1slAk/maxresdefault.jpg,1280,720,Seja muito bem vindo ao Universo Programado! Neste vídeo você verá como a Inteligência Artificial aprendeu a jogar o dinossauro da Google! Machine Learning é...,video.other,algoritmo,2438346.0
478,Os 3 Melhores Cursos de Data Science que fiz no Coursera,Mario Filho,1.6,,23,9,2019,YouTube,https://www.youtube.com/watch?v=r6nN8OQ-6co,https://i.ytimg.com/vi/r6nN8OQ-6co/maxresdefault.jpg,1280,720,Os três cursos que eu escolheria se estivesse começando a minha carreira de cientista de dados hoje.Machine Learning - Andrew Ng: https://bit.ly/ml-andrewDee...,video.other,neural networks,3146.5
592,Tutorial R | Gráfico de controle Xbar,Carvalho Ribeiro,0.062,,10,3,2019,YouTube,https://www.youtube.com/watch?v=nSC9od-PO58,https://i.ytimg.com/vi/nSC9od-PO58/hqdefault.jpg,480,360,"Tópico - Process ImprovementControle estatístico de processos em 3 perspectivas• Pós guerra com Deming, Shewhart e Juran• Ferramentas de software de apoio• I...",video.other,seis sigma,4866.0
580,Tipos de Aprendizagem de Máquina | Machine Learning: Fundamentos,Iury Rosal,0.055,,2,2,2022,YouTube,https://www.youtube.com/watch?v=Cn9EV3mjT-k,https://i.ytimg.com/vi/Cn9EV3mjT-k/maxresdefault.jpg,1280,720,"Seja muito bem vindo! Neste vídeo trago os tipos de aprendizado de máquina, dando uma visão geral das possibilidades com machine learning.✔ Quer aprender ain...",video.other,aprendizado de maquina,790.0
77,Arquiteto Cloud ou Arquiteto de Dados? Qual é a Diferença?,LCDados,0.017,,31,3,2022,YouTube,https://www.youtube.com/watch?v=3eP93k8gCZI,https://i.ytimg.com/vi/3eP93k8gCZI/hqdefault.jpg,480,360,"Se você tem dúvidas do que faz um arquiteto cloud e um arquiteto de dados e qual a diferença entre eles, este vídeo vai tirar todas suas dúvidas.",video.other,o que faz um arquiteto cloud?,3267.0
390,Machine Learning Fundamentals: Cross Validation,StatQuest with Josh Starmer,25.0,,24,4,2018,YouTube,https://www.youtube.com/watch?v=fSytzGwwBVw,https://i.ytimg.com/vi/fSytzGwwBVw/maxresdefault.jpg,1280,720,One of the fundamental concepts in machine learning is Cross Validation. It's how we decide which machine learning method would be best for our dataset. Chec...,video.other,Data Science,1690087.0
442,O que eu faria se COMEÇASSE DO ZERO hoje na CIÊNCIA DE DADOS | Cientista de Dados Responde,Programação Dinâmica,3.8,,14,10,2021,YouTube,https://www.youtube.com/watch?v=5hCCDdzurhA,https://i.ytimg.com/vi/5hCCDdzurhA/maxresdefault.jpg,1280,720,✅  Se inscreva na Semana Dados da Alura 👉  https://bit.ly/alura-semanadados-progdinamica Uma semana inteira de encontros ao vivo e totalmente gratuitos para...,video.other,cientista de dados o que faz,96006.0
61,An Image is Worth 16x16 Words: Transformers for Image Recognition at Scale (Paper Explained),Yannic Kilcher,7.2,,4,10,2020,YouTube,https://www.youtube.com/watch?v=TrdevFK_am4,https://i.ytimg.com/vi/TrdevFK_am4/maxresdefault.jpg,1280,720,"#ai #research #transformersTransformers are Ruining Convolutions. This paper, under review at ICLR, shows that given enough data, a standard Transformer can ...",video.other,transformer computer vision,274580.0
359,Kaggle Data Science Project - Predict the effect of Genetic Variants,miracl6,0.47600000000000003,,23,8,2020,YouTube,https://www.youtube.com/watch?v=gy4Iq2lXzwk,https://i.ytimg.com/vi/gy4Iq2lXzwk/maxresdefault.jpg,1280,720,"Курс Data Science для начинающих PyMagic Подробная информация о курсе, программа обучения по ссылке - https://pymagic.ru В этом видео мы сделаем с вами проек...",video.other,Genetic Variants,13970.0
147,Collaborative Filtering,Machine Learning- Sudeshna Sarkar,0.275,,27,7,2016,YouTube,https://www.youtube.com/watch?v=RVJV8VGa1ZY,https://i.ytimg.com/vi/RVJV8VGa1ZY/maxresdefault.jpg,1280,720,,video.other,,37684.0
115,CIÊNCIA de DADOS no FUTEBOL pode ACELERAR os avanços da INTELIGÊNCIA ARTIFICIAL,Programação Dinâmica,0.5710000000000001,,13,5,2021,YouTube,https://www.youtube.com/watch?v=K0xsS54HnPk,https://i.ytimg.com/vi/K0xsS54HnPk/maxresdefault.jpg,1280,720,"Seria natural pensarmos que o Futebol pode se beneficiar da Inteligência Artificial, assim como outros esportes (basquete, tênis e beisebol), mas o que mais ...",video.other,ciência de dados no futebol,5954.0
548,Samy Dana explica modelo de estatísticas que PREVÊ RESULTADOS DE FUTEBOL,Pânico Jovem Pan,1.6,3.62,17,9,2019,YouTube,https://www.youtube.com/watch?v=N6b5zgAoCmI,https://i.ytimg.com/vi/N6b5zgAoCmI/maxresdefault.jpg,1280,720,Samy Dana explica modelo de estatísticas que PREVÊ RESULTADOS DE FUTEBOLInscreva-se no nosso canal:http://www.youtube.com/panicojovempan Entre no nosso site:...,video.other,jair bolsonaro,59879.5
439,O melhor teste estatístico para COMPARAÇÃO (Parte 1- Variáveis qualitativas nominais),Canal Pesquise,1.2,,9,9,2019,YouTube,https://www.youtube.com/watch?v=HXjdHU7J4v0,https://i.ytimg.com/vi/HXjdHU7J4v0/hqdefault.jpg,480,360,Este vídeo é o primeiro de uma série de 3 vídeos que tem como objetivo lhe apresentar os fatores que influenciam na escolha do melhor teste estatístico para ...,video.other,parte 1,69277.0
368,"Large Language Models and the Future of AI with Connor Leahy, EleutherAI",MLT Artificial Intelligence,0.395,,30,9,2021,YouTube,https://www.youtube.com/watch?v=StLtMcsbQes,https://i.ytimg.com/vi/StLtMcsbQes/hqdefault.jpg?sqp=-oaymwEmCOADEOgC8quKqQMa8AEB-AHUBoAC4AOKAgwIABABGGUgZShlMA8=&rs=AOn4CLCVhJ5k13Lg5m34nG8ZzqAFuAzBVQ,480,360,"We welcomed Connor Leahy, Co-founder and AI Researcher at EleutherAI (https://www.eleuther.ai/), for a talk on ""Large Language Models and the future of AI"". ...",video.other,Machine Learning Tokyo,11460.0
625,What tools should you know as a Data Engineer?,Kahan Data Solutions,0.9530000000000001,,22,6,2022,YouTube,https://www.youtube.com/watch?v=UDmViyjdHuw,https://i.ytimg.com/vi/UDmViyjdHuw/maxresdefault.jpg,1280,720,The modern data engineering stack is overwhelming...Everyday there seems to be a new tool and it can be hard to know what to learn.While it’d be impossible t...,video.other,business intelligence,9129.0
655,📐🏠✏️TUDO SOBRE O CURSO/FACULDADE DE ARQUITETURA E URBANISMO! (Com Lívia e Lucas) - Débora Aladim,Débora Aladim,25.0,3.38,22,11,2020,YouTube,https://www.youtube.com/watch?v=gW6HE_SIa-k,https://i.ytimg.com/vi/gW6HE_SIa-k/maxresdefault.jpg,1280,720,Entrevistando estudantes de arquitetura e urbanismo! Precisa saber desenhar? Como são os estágios? Faço arquitetura ou engenharia? Como é com design de inter...,video.other,redação enem,74199.0
315,Inteligencia Artificial en la Fotografía...¿Estamos a salvo?,Leo Baquero,0.273,,13,4,2023,YouTube,https://www.youtube.com/watch?v=Nd2DWsRQrPo,https://i.ytimg.com/vi/Nd2DWsRQrPo/maxresdefault.jpg,1280,720,En este video podcast hablamos sobre como la Inteligencia Artificial nos puede servir como la mayor herramienta posible para nosotros los fotógrafos y si pod...,video.other,leonardo ai,25813100.0
557,Stanford Webinar - GPT-3 & Beyond,Stanford Online,5.4,,31,1,2023,YouTube,https://www.youtube.com/watch?v=-lnHHWRCDGk,https://i.ytimg.com/vi/-lnHHWRCDGk/maxresdefault.jpg,1280,720,GPT3 & Beyond: Key concepts and open questions in a golden age for natural language understandingListen in as Professor Christopher Potts discusses the signi...,video.other,AI,392812.5
324,Intro to Supervised Classification with Vijayabharathi Karuppasamy | Kaggle's #30daysofML 2021,Kaggle,0.113,,20,10,2021,YouTube,https://www.youtube.com/watch?v=ylUrUfvQrmA,https://i.ytimg.com/vi/ylUrUfvQrmA/maxresdefault.jpg,1280,720,SUBSCRIBE: https://www.youtube.com/c/kaggle?sub_confirmation=1&utm_medium=youtube&utm_source=channel&utm_campaign=yt-subAbout Kaggle:Kaggle is the world's la...,video.other,CS,9505.5
292,How to Make a Data Science Project with Kaggle,Google Cloud Tech,3.1,,3,7,2018,YouTube,https://www.youtube.com/watch?v=m2DfpM6MyB8,https://i.ytimg.com/vi/m2DfpM6MyB8/maxresdefault.jpg,1280,720,"It can take a lot of tools to do data science, but Kaggle is a one-stop shop that provides all the tools to share and collaborate on data science projects. I...",video.other,GDS: Yes;,111279.0
371,Las 10 Preguntas Más Increíbles que Fueron Respondidas por la IA Más Poderosa,Atraviesa lo desconocido,19.0,3.36,8,2,2023,YouTube,https://www.youtube.com/watch?v=9cx0utql1Qg,https://i.ytimg.com/vi/9cx0utql1Qg/maxresdefault.jpg,1280,720,"ChatGPT, es una inteligencia artificial de uso mundial que está cambiando todo. Pero ¿Cuáles son sus secretos? ¿Responde preguntas extrañas o aterradoras? ¿Q...",video.other,Atraviesa lo desconocido,1541800.5
485,PROCESSAMENTO DE LINGUAGEM NATURAL (NLP) - Concurso Banco do Brasil - Agente de Tecnologia,Arnaldo Junior,0.113,,20,3,2023,YouTube,https://www.youtube.com/watch?v=KPl901_PdV8,https://i.ytimg.com/vi/KPl901_PdV8/maxresdefault.jpg,1280,720,"Aula sobre PROCESSAMENTO DE LINGUAGEM NATURAL, ramo da inteligência artificial, tema cobrado no concurso do Banco do Brasil 2023, para o cargo Escriturário A...",video.other,,641.0
22,5 Inteligências Artificiais (IA) Que Podem Te Deixar Milionário,Jovens de Negócios,14.0,2.29,15,3,2023,YouTube,https://www.youtube.com/watch?v=cVNLJgGaRAs,https://i.ytimg.com/vi/cVNLJgGaRAs/maxresdefault.jpg,1280,720,"👉 Inscreva-se no evento O Próximo Nível: http://bit.ly/3J1hA3fVocê já ouviu falar em inteligências artificiais que podem te deixar milionário? Neste vídeo, ...",video.other,chatgpt,149669.0
226,Don’t waste money in data science courses | Reality behind data science | Ranjan Sir | DataGyan,Data Gyan,2.4,,18,,2022,YouTube,https://www.youtube.com/watch?v=cTgGJpPiqjk,https://i.ytimg.com/vi/cTgGJpPiqjk/maxresdefault.jpg?sqp=-oaymwEmCIAKENAF8quKqQMa8AEB-AHOBYACgAqKAgwIABABGGUgTihIMA8=&rs=AOn4CLCf5DBxpbUZ9LFKRICGEovUBgtMeA,1280,720,"#datascience #dataanalytics #datagyan Data Gyan, Bangalore is the most preferred institute for freshers & working professionals. 👉IIT Kharagpur recognize th...",video.other,,497474.5
470,O que é multicolinearidade? (parte 1/3),economiaetv,0.20400000000000001,,25,9,2020,YouTube,https://www.youtube.com/watch?v=Hv9TlslegyQ,https://i.ytimg.com/vi/Hv9TlslegyQ/maxresdefault.jpg,1280,720,"➡️ CONSULTORIA, ASSESSORIA ACADÊMICA E PARCERIAS: economiaetv@gmail.com.➡️ CURSO: INTRODUÇÃO A MODELOS DE REGRESSÃO: TEORIA E APLICAÇÃO *https://forms.gle/rJ...",video.other,,2125.0
123,CS25 I Stanford Seminar - Transformers in Language: The development of GPT Models including GPT3,Stanford Online,0.24,,11,7,2022,YouTube,https://www.youtube.com/watch?v=qGkzHFllWDY,https://i.ytimg.com/vi/qGkzHFllWDY/maxresdefault.jpg?sqp=-oaymwEmCIAKENAF8quKqQMa8AEB-AH-CYAC0AWKAgwIABABGDcgIih_MA8=&rs=AOn4CLAKREB5-Bxjb3Jlo1d1TFsIC9xfaA,1280,720,"While the Transformer architecture is used in a variety of applications across a number of domains, it first found success in natural language. Today, Transf...",video.other,Artificial intelligence,278153.0
489,Por Que Aprender Deep Learning?,Data Science Academy,0.009000000000000001,,9,2,2023,YouTube,https://www.youtube.com/watch?v=bsqXv3pSVpw,https://i.ytimg.com/vi/bsqXv3pSVpw/maxresdefault.jpg?sqp=-oaymwEmCIAKENAF8quKqQMa8AEB-AH-CYAC0AWKAgwIABABGBQgSCh_MA8=&rs=AOn4CLD15IPi0QjjwhiiNzc3Oxl4ViHazQ,1280,720,Curso Gratuito Fundamentos de Inteligência ArtificialVocê já imaginou um curso de Inteligência Artificial ministrado por um Avatar?Você acha que um Robô pode...,video.other,O que é Inteligência Artificial?,748.0
363,Kick-Off Webinar: IceCube – Neutrinos in Deep Ice ML Competition with Dr. Philipp Eller | Kaggle,Kaggle,0.1,,27,1,2023,YouTube,https://www.youtube.com/watch?v=_G4Nx20BVPg,https://i.ytimg.com/vi/_G4Nx20BVPg/maxresdefault.jpg,1280,720,"Welcome to the IceCube neutrino challenge!Neutrinos allow us to gain deep insights into the fundamental structure of matter, and to research our universe unc...",video.other,CS,1951348.5
416,Nova I.A. Cria Qualquer Imagem… e é assustador!,Filipe Deschamps,17.0,,11,1,2021,YouTube,https://www.youtube.com/watch?v=IKydZtF9I3w,https://i.ytimg.com/vi/IKydZtF9I3w/maxresdefault.jpg,1280,720,"DALL·E é uma nova Inteligência Artificial que foi lançada faz poucos dias e consegue criar Imagens a partir de Textos. Ela é mais uma empreitada da OpenAI, e...",video.other,tecnologia,697577.0
455,O que é Data Science? #HipstersPontoTube,Alura,25.0,,3,4,2019,YouTube,https://www.youtube.com/watch?v=5b9Z8toVaAU,https://i.ytimg.com/vi/5b9Z8toVaAU/maxresdefault.jpg,1280,720,"Python é o novo Excel? Para que serve o R, Pandas e Jupyter? E qual é, afinal, a diferença entre o Data Science, Business Intelligence e Machine Learning? De...",video.other,tutorial data cience,214877.0
611,Vídeo 33 - O que é a Entropia de Shannon?,Ciência de Dados e Aprendizado de Máquina,0.428,,22,2,2018,YouTube,https://www.youtube.com/watch?v=maJ0oG-JzGw,https://i.ytimg.com/vi/maJ0oG-JzGw/maxresdefault.jpg,1280,720,Este vídeo introduz a Entropia de Shannon.Acesse nossos códigos em https://bitbucket.org/rodrigo_mello/ml4u,video.other,Aprendizado de Máquina,15669.0
321,Inteligência artificial da Microsoft CLONA sua Voz em Apenas 03 Segundos!,CanalJMS,0.859,2.35,11,1,2023,YouTube,https://www.youtube.com/watch?v=2eBTJ323blI,https://i.ytimg.com/vi/2eBTJ323blI/maxresdefault.jpg,1280,720,"Foi anunciado um novo avanço de inteligência artificial da Microsoft que pode clonar a sua voz depois de ouvi-lo falar por apenas 03 segundos, o programa cha...",video.other,text to speech,374452.0
159,Como manter a sanidade nesse caos?,FERRÉZ,,,11,4,2023,YouTube,https://www.youtube.com/watch?v=sSM8d_c19Zg,https://i.ytimg.com/vi/sSM8d_c19Zg/maxresdefault.jpg,1280,720,Minha campanha no APOIA.SEhttp://apoia.se/ferrezPara manter esse canal e seus lançamentos. Seja parceiro dessa iniciativa.Produtos da marca 1DASUL criada por...,video.other,capao pecado,121216.5
