,titulo,nome_canal,likes_video_(em_milhares),inscritos_canal_(em_milhoes),dia,mes,ano,nome_site,url,imagem,largura_imagem,altura_imagem,descricao,tipo,tags,visualizacoes
328,Introdução a Estatística: Tipos de Variáveis e Modelos Estatísticos - Estatística #01 - UFLA Online,UFLA Online,0.194,,29,9,2017,YouTube,https://www.youtube.com/watch?v=IPibnJkyHmk,https://i.ytimg.com/vi/IPibnJkyHmk/maxresdefault.jpg,1280,720,Nesta aula você entenderá o que são variáveis Discretas e continuas e seus subtipos e os modelos Determinístico e Probabilístico.Assista as Outras Aulas do C...,video.other,universidade federal de lavras,2934.0
235,EVIEWS SUPUESTOS MODELO ECONOMETRICO,Estadística y Econometría,0.191,,25,11,2011,YouTube,https://www.youtube.com/watch?v=WWTyhRGKRyU,https://i.ytimg.com/vi/WWTyhRGKRyU/maxresdefault.jpg,1280,720,WhatsApp: https://wa.me/59176410675Archivos: Base de datos y documentos adicionaleshttps://drive.google.com/open?id=19cTw0cSVSw_ndl7e3p7rT12u94u0AMagEse fue ...,video.other,ECONOMETRIA UMSS,925.0
341,Introdução à Análise de Séries Temporais no R com Kaio Strelow | Prof. Fernanda Maciel,Prof. Fernanda Maciel,,,6,10,2021,YouTube,https://www.youtube.com/watch?v=9GDGk3DP3XM,https://i.ytimg.com/vi/9GDGk3DP3XM/hqdefault.jpg,480,360,Nessa live iremos aprender sobre séries temporais e como fazer no R com o Kaio Strelow.Link com o material: https://bit.ly/material_rKaio Arlei Strelow é aca...,video.other,,3092.0
79,Arquitetura de Uma Plataforma de Dados e Data Lake,Alexandre Lopes,,,24,2,2021,YouTube,https://www.youtube.com/watch?v=Z7blpZDCXv0,https://i.ytimg.com/vi/Z7blpZDCXv0/maxresdefault.jpg,1280,720,Fala Pessoal!Neste vídeo eu navego com vocês em uma arquitetura de uma plataforma de dados e um data lake e explico os principais componentes desta soluçãoEx...,video.other,tecnologia,11797.0
418,"Não recomendo jogar jogo de zumbi em realidade virtual, é traumatizante",T3ddy Games,161.0,3.92,10,8,2021,YouTube,https://www.youtube.com/watch?v=hUFvS2E7W_g,https://i.ytimg.com/vi/hUFvS2E7W_g/maxresdefault.jpg,1280,720,obrigado por assistir s2Instagram: http://instagram.com/t3ddyyyyTwitter: http://twitter.com/t3ddyyyyyDiscord: https://discord.gg/familReddit: https://www.red...,video.other,novo the walking dead,3912466.0
452,"O que é ""o tal do Algoritmo""? - Lógica e Programação",Diolinux,8.2,,8,3,2020,YouTube,https://www.youtube.com/watch?v=z1XTcKKRbKM,https://i.ytimg.com/vi/z1XTcKKRbKM/maxresdefault.jpg,1280,720,"Todo mundo culpa ""o algoritmo"" hoje em dia por todos os fenômenos sociais através da internet. Mas o que realmente é uma algoritmo? Como ele se relaciona com...",video.other,lógica e algoritmos,4129225.6666666665
510,Qual a diferença entre regressão e séries temporais?,Samuel Macêdo,0.264,,20,4,2022,YouTube,https://www.youtube.com/watch?v=ocefsjRw_yA,https://i.ytimg.com/vi/ocefsjRw_yA/maxresdefault.jpg,1280,720,"Você sabe a diferença entre regressão e séries temporais? Muita gente confunde as duas e, na verdade,  é uma dúvida bem pertinente, confunde mesmo. Afinal, a...",video.other,,5436.5
488,Part  - 02  || Azure Data Engineer || Full Course || IT Parivaar,𝐈𝐓 - 𝐏𝐚𝐫𝐢𝐯𝐚𝐚𝐫,0.031,,22,,2022,YouTube,https://www.youtube.com/watch?v=oGoYLM0MxuA,https://i.ytimg.com/vi/oGoYLM0MxuA/maxresdefault.jpg,1280,720,Hi …  Hello... Dear's....🎯 🆆🅴🅻🅲🅾🅼🅴 🔫 it's Our IT community.. it is North India Largest Free Courses Serves....======================================...,video.other,,1699.0
357,Jay Alammar - Large Language Models for Real-World Applications - A Gentle Intro,PyData,0.181,,6,7,2022,YouTube,https://www.youtube.com/watch?v=xSGX8gBQDO8,https://i.ytimg.com/vi/xSGX8gBQDO8/maxresdefault.jpg?sqp=-oaymwEmCIAKENAF8quKqQMa8AEB-AH-CYAC0AWKAgwIABABGGMgYyhjMA8=&rs=AOn4CLDDiK64m_gKIs2t2--murqD82QRfg,1280,720,Jay Alammar Presents:Large Language Models for Real-World Applications - A Gentle IntroMachine language understanding and generation has been undergoing rapi...,video.other,scientific programming,456462.4
21,5 Dicas Para Estudar Mais RÁPIDO e LEMBRAR de TUDO,Mario Filho,0.853,,4,10,2021,YouTube,https://www.youtube.com/watch?v=6kodkD1le3c,https://i.ytimg.com/vi/6kodkD1le3c/maxresdefault.jpg,1280,720,"Estude melhor, mais rápido e lembre de tudo!Lembre-se de deixar o like e se inscrever no canal para receber mais dicas!Timestamps:0:00 Intro0:36 Dica #11:57 ...",video.other,como estudar para concurso,11606.5
157,Como funciona o StackOverflow? #HipstersPontoTube,Alura,3.6,,29,4,2019,YouTube,https://www.youtube.com/watch?v=VY4tOs4UPhQ,https://i.ytimg.com/vi/VY4tOs4UPhQ/maxresdefault.jpg,1280,720,Como funciona um dos maiores fóruns de dúvidas de tecnologia? Conheça o Stack Overflow com a Roberta e descubra se pode ou não colocar emoji na sua pergunta ...,video.other,python,112180.5
431,O QUE É DEEP LEARNING?,Argonalyst,2.1,,13,10,2016,YouTube,https://www.youtube.com/watch?v=R-63YMTnuZw,https://i.ytimg.com/vi/R-63YMTnuZw/maxresdefault.jpg,1280,720,"Um vídeo introdutório sobre o conceito de redes neurais (atualmente chamado de deep learning), cubos mágicos e Super Mario.Artigo da Wikipedia sobre Deep Lea...",video.other,reconhecimento de imagem,309453.0
469,O que é machine learning ou aprendizado de máquina?,GCFAprendeLivre,0.092,,26,11,2018,YouTube,https://www.youtube.com/watch?v=tWBaqPFSYXk,https://i.ytimg.com/vi/tWBaqPFSYXk/maxresdefault.jpg,1280,720,Você sabe o que é Machine Learning ou Aprendizado de Máquina? Neste vídeo lhe mostraremos tudo sobre este conceito.Se você quiser aprender mais sobre esse te...,video.other,tecnologia do futuro,978.5
346,Introdução à Ciência de Dados - Ciência de Dados e a Indústria 4.0,UNIVESP,0.546,1.2,13,10,2021,YouTube,https://www.youtube.com/watch?v=mHKgXOJZgAw,https://i.ytimg.com/vi/mHKgXOJZgAw/maxresdefault.jpg,1280,720,"univesp.brCiência de Dados - COM350 Univesp - Universidade Virtual do Estado de São Paulo Professor: José Eduardo Santarem SegundoNesta videoaula, vamos apre...",video.other,bigdata,6053.0
114,CHATGPT é o novo EXTERM1NAD0R do FUTURO? 🤖,Cortes do Flow \\x5bOFICIAL\\x5d,1.4,2.59,7,3,2023,YouTube,https://www.youtube.com/watch?v=BW1oL527sgg,https://i.ytimg.com/vi/BW1oL527sgg/maxresdefault.jpg,1280,720,"[INTELIGÊNCIA ARTIFICIAL] ÁLVARO MACHADO DIAS e MARTHA GABRIEL - Flow #183 youtube.com/live/O2PehdBokN8~~~~~~~HIDROMELPhilip Mead: não é cerveja, não é vodka...",video.other,cortes podcast,201760.0
539,Redes neurais recorrentes e Long Short-Term Memory,Diego Silva,0.053,,8,4,2021,YouTube,https://www.youtube.com/watch?v=CZny_xxJT4s,https://i.ytimg.com/vi/CZny_xxJT4s/maxresdefault.jpg?sqp=-oaymwEmCIAKENAF8quKqQMa8AEB-AHUBoAC4AOKAgwIABABGCogMCh_MA8=&rs=AOn4CLBF9Bz8S68uYHSRoHTTjJoq8iJaBA,1280,720,"Voltando às aulas de conceitos, falo sobre como lidar com sequências utilizando redes neurais recorrentes (recurrent neural networks, RNN) e Long Short-Term ...",video.other,,138.0
167,Como uma Rede Neural Aprende? Tutorial para Leigos,Escola de Inteligência Artificial,1.9,,30,4,2020,YouTube,https://www.youtube.com/watch?v=mWD8wWwZpi8,https://i.ytimg.com/vi/mWD8wWwZpi8/maxresdefault.jpg,1280,720,Veja formações online em Ciência de Dados e Inteligência Artificial em www.datascientist.com.br,video.other,Inteligência Artificial,162777.5
327,"Introduction | Deep Learning Tutorial 1 (Tensorflow Tutorial, Keras & Python)",codebasics,,,11,7,2020,YouTube,https://www.youtube.com/watch?v=Mubj_fqiAv8,https://i.ytimg.com/vi/Mubj_fqiAv8/maxresdefault.jpg,1280,720,"With this video, I am beginning a new deep learning tutorial series for total beginners. In this deep learning tutorial python, I will cover following things...",video.other,tensorflow,131789.0
366,LSTM is dead. Long Live Transformers!,Seattle Applied Deep Learning,12.0,,3,,2019,YouTube,https://www.youtube.com/watch?v=S27pHKBEp30,https://i.ytimg.com/vi/S27pHKBEp30/maxresdefault.jpg,1280,720,Leo Dirac (@leopd) talks about how LSTM models for Natural Language Processing (NLP) have been practically replaced by transformer-based models.  Basic backg...,video.other,attention mechanism,355256.5
39,A VOLTA DA CASA INTELIGENTE! - Smart Home 3,Coisa de Nerd,173.0,11.1,28,8,2018,YouTube,https://www.youtube.com/watch?v=GKjXUEciEEY,https://i.ytimg.com/vi/GKjXUEciEEY/maxresdefault.jpg,1280,720,INSCREVA-SE! É DE GRAÇA: https://goo.gl/5hy7QBCamisetas Coisa de Nerd: http://bit.ly/2arsmPrEste é um vídeo sobre a nossa tentativa de transformar a nossa ca...,video.other,controle de voz,1404506.0
107,BAKA GAIJIN E O FUTURO DA HUMANIDADE,Felipe Durante,0.5660000000000001,,14,4,2023,YouTube,https://www.youtube.com/watch?v=4teEwTf_sFo,https://i.ytimg.com/vi/4teEwTf_sFo/maxresdefault.jpg,1280,720,Já deixou o like e um comentário? ME SEGUE LÁ NO www.instagram.com/felipe.duranteE ME SEGUE NO www.twitter.com/fedurante TAMBÉM!#felipedurante #china #bakaga...,video.other,Baka gaijin,12135.0
246,"Engenheiro dados, Porque você NÂO deve se tornar um.",Codifike,0.714,,3,10,2022,YouTube,https://www.youtube.com/watch?v=f64_Gd6nC8Y,https://i.ytimg.com/vi/f64_Gd6nC8Y/maxresdefault.jpg,1280,720,"Engenheiro de dados, uma profissão muito cobiçada hoje, porém vou te contar alguns motivos para não se tornar um engenheiro de dados.Melhor curso da área de ...",video.other,big data analysis,9132.0
26,7 LIVROS DE DATA SCIENCE que todo cientista de dados DEVERIA LER,Carlos Melo,1.3,,30,4,2021,YouTube,https://www.youtube.com/watch?v=kZ4dBB4h4cE,https://i.ytimg.com/vi/kZ4dBB4h4cE/maxresdefault.jpg,1280,720,"Nesse vídeo vou te mostrar 7 livros que te farão aprender Data Science 2021! Conteúdo selecionado por mim, baseado nas minhas próprias leituras, e que agora ...",video.other,storytelling com dados,5747.0
595,Tópicos em IA - Aula 10 - Parte 1 - Introdução - Visão Computacional e Redes Neurais Convolucionais,Rafael Rossi,0.013000000000000001,,4,,2020,YouTube,https://www.youtube.com/watch?v=HV9cB6UKLIs,https://i.ytimg.com/vi/HV9cB6UKLIs/maxresdefault.jpg,1280,720,Introdução ao tema da aula e as diferentes arquiteturas de redes neurais (aula ministrada na disciplina 0709.000.408-3 TÓPICOS EM INTELIGÊNCIA ARTIFICIAL do ...,video.other,CNNs,112.0
491,Por que a Inteligência Artificial não é um bando de IF-ELSE?,Universo Programado,38.0,,17,2,2020,YouTube,https://www.youtube.com/watch?v=F0Iby7KCXls,https://i.ytimg.com/vi/F0Iby7KCXls/maxresdefault.jpg,1280,720,✅ - Cursos da Alura com 10% de desconto: https://www.alura.com.br/promocao/universoprogramado----------------------------------------------------------------...,video.other,turing,1336312.5
410,"Modelos econométricos. Hipótesis, contrastes y métodos de estimación |  | UPV",Universitat Politècnica de València - UPV,0.642,,27,7,2015,YouTube,https://www.youtube.com/watch?v=3jk8cFNkzuk,https://i.ytimg.com/vi/3jk8cFNkzuk/maxresdefault.jpg,1280,720,"Título: Modelos econométricos. Hipótesis, contrastes y métodos de estimaciónAutor/a: Neira Gómez Isabel+ Universitat Politècnica de València UPV: https://www...",video.other,tutorial stata,32030.0
268,"GPT4 foi inserido dentro do Robô Ameca | Pesquisadores criam ""cérebro"" de alto desempenho para IA",Realidade Impressionante,15.0,,5,4,2023,YouTube,https://www.youtube.com/watch?v=cY2-VoN_F2c,https://i.ytimg.com/vi/cY2-VoN_F2c/maxresdefault.jpg,1280,720,A inteligência artificial GPT da OpenAi foi inserida no Robô humanoide Ameca; Novos sensores com padrão 3D permitem que os robôs sejam controlados pela mente...,video.other,Ameca with chatgpt,61220.0
34,A PROFISSÃO DE GESTOR DE TRÁFEGO VAI ACABAR! E isso não é um clickbait!,James William,0.128,,12,4,2023,YouTube,https://www.youtube.com/watch?v=zdytkziQR40,https://i.ytimg.com/vi/zdytkziQR40/maxresdefault.jpg,1280,720,🔥 Tenha acesso a todo o conteúdo do SMT por 30 dias e descubra o poder de ser muito mais que um simples gestor de tráfego.Entre agora ➽ https://cutt.ly/smt-...,video.other,A.I. vai substituir o gestor de tráfego,28139.0
405,Modelo pronto de introdução para qualquer tema | redação para concurso,Português de Sucesso,0.742,,20,1,2022,YouTube,https://www.youtube.com/watch?v=pCqWNPrX8kQ,https://i.ytimg.com/vi/pCqWNPrX8kQ/maxresdefault.jpg,1280,720,#vunesp #fgv #fcc #PCRR #redaçãpVunesp #cebraspe #portuguêsparaconcurso #redacaonota1000 #redaçãoparaconcurso 🔶 Redes sociais: ❇️ Instagram: @professorachai...,video.other,cebrasp,5969.0
624,"What is backpropagation really doing? | Chapter 3, Deep learning",3Blue1Brown,66.0,5.09,3,11,2017,YouTube,https://www.youtube.com/watch?v=Ilg3gGewQ5U,https://i.ytimg.com/vi/Ilg3gGewQ5U/maxresdefault.jpg,1280,720,What's actually happening to a neural network as it learns?Help fund future projects: https://www.patreon.com/3blue1brownAn equally valuable form of support ...,video.other,neural networks,2231857.0
259,FILIPE SANTOS | CHAT GPT E INTELIGÊNCIA ARTIFICIAL | | Criative-se Podcast Ep.74,Canal Eleve,,,11,4,2023,YouTube,https://www.youtube.com/watch?v=-AfOFCnV298,https://i.ytimg.com/vi/-AfOFCnV298/maxresdefault.jpg,1280,720,"🚩 Playlist completa com mais episódios : https://bit.ly/3tt1jwe🚩 Inscreva-se para receber todos os vídeos: https://bit.ly/2WKBuGJInovação, criatividade e l...",video.other,ministerio com jovens,17103.0
31,A INTELIGÊNCIA ARTIFICIAL DECIDE NOSSO DIA | Gabriel e Shirley 2.0,Gabriel e Shirley 2.0,10.0,,2,3,2023,YouTube,https://www.youtube.com/watch?v=UeBnBST3uY0,https://i.ytimg.com/vi/UeBnBST3uY0/maxresdefault.jpg,1280,720,"Gabi e Shi vão ter que fazer tudo que a inteligência artificial, chat gpt, decidir!O que vestir, o que comer, o que fazer.Se inscreva no canal Gabriel e Shir...",video.other,engraçado,552724.0
400,Modelagem de Dados - Conceitos de Bancos de Dados,Bóson Treinamentos,17.0,,11,7,2017,YouTube,https://www.youtube.com/watch?v=Q_KTYFgvu1s,https://i.ytimg.com/vi/Q_KTYFgvu1s/hqdefault.jpg,480,360,"Modelagem de Dados - Conceitos de Bancos de DadosNeste vídeo apresentamos os conceitos básicos de Bancos de Dados, abordando os principais modelos (com ênfas...",video.other,o que é modelagem de dados,208899.0
461,O que é Kaggle?,Let\\x27s Data,0.276,,7,1,2022,YouTube,https://www.youtube.com/watch?v=n9esdk2QAN0,https://i.ytimg.com/vi/n9esdk2QAN0/hqdefault.jpg,480,360,"Pra que vou ver esse vídeo, nem quero competir?! Porque Kaggle é puro aprendizado, padawan, e tudo de graça!! Cola no Let’s Data pra saber como explorar esse...",video.other,big data,2446.0
546,SERIA O PODEROSO PITUBEX É UMA INTELIGENCIA ARTIFICIAL... | MIR4,Cortes do Marco Veio \\x5bOFICIAL\\x5d,0.052000000000000005,,13,4,2023,YouTube,https://www.youtube.com/watch?v=07YwgiKiaXw,https://i.ytimg.com/vi/07YwgiKiaXw/maxresdefault.jpg,1280,720,"Gold para cashar a conta? é no Rei dos Coins xDDDDQuem puder fortalecer, usa o nosso link tmj o/:https://www.reidoscoins.com.br/?tracking=6310e965527f5Todas ...",video.other,CORTES,4432.0
340,Introdução ao PyTorch | Redes Neurais | Primeiros passos com Pytorch | Deep Learning #1,Programação Dinâmica,,,18,9,2021,YouTube,https://www.youtube.com/watch?v=cGxv8tOaA7I,https://i.ytimg.com/vi/cGxv8tOaA7I/maxresdefault.jpg,1280,720,"Redes neurais como você nunca viu! Nesta live, iremos ensinar sobre redes neurais artificiais e como você pode implementá-las usando a linguagem de programaç...",video.other,perceptron,16785.0
620,What are large language models (LLMs) and how do they work?,Boost AI,0.08,,24,2,2023,YouTube,https://www.youtube.com/watch?v=UCg8W236vfw,https://i.ytimg.com/vi/UCg8W236vfw/maxresdefault.jpg,1280,720,"In this video, you'll learn all about Large Language Models (LLMs) - what they are, how they work, and their impact. The video delves into the technical aspe...",video.other,,121237.0
19,2nd Place Solution for the Google Smartphone Decimeter Challenge | Kaggle,Kaggle,0.039,,31,10,2022,YouTube,https://www.youtube.com/watch?v=C-lSXptkHOM,https://i.ytimg.com/vi/C-lSXptkHOM/maxresdefault.jpg?sqp=-oaymwEmCIAKENAF8quKqQMa8AEB-AH-CYAC0AWKAgwIABABGBEgXChyMA8=&rs=AOn4CLBBq1i1JolqT8_NFYAKstRPr0IaGw,1280,720,Bestfitting (https://www.kaggle.com/bestfitting) shares his 2nd place winning solution for the ION GNSS+ 2022 Smartphone Decimeter Challenge.SUBSCRIBE: https...,video.other,CS,4459.666666666667
459,O que é Inteligência Artificial?,Didática Tech,1.6,,21,6,2019,YouTube,https://www.youtube.com/watch?v=ID5Ui22F8HQ,https://i.ytimg.com/vi/ID5Ui22F8HQ/maxresdefault.jpg,1280,720,Nesse vídeo vamos aprender o que é inteligência artificial e como ela está sendo aplicada no nosso dia-a-dia. Organização do vídeo:0:05 Utilizações modernas ...,video.other,inteligência artificial conceito,39226.0
183,Curso Completo de Ciências de Dados – Prof. Erick Muzart,Estratégia Concursos,0.65,2.35,23,7,2022,YouTube,https://www.youtube.com/watch?v=L8mbZzoqxCo,https://i.ytimg.com/vi/L8mbZzoqxCo/maxresdefault.jpg,1280,720,🦉 Cursos Completos para Ciências de Dados → https://bit.ly/3csWpcS🥇  Estude com o material que mais aprova no Brasil → https://bit.ly/3ASP0O6▶ Assista a Tr...,video.other,concursos 2022,5861.0
344,Introdução à Ciência de Dados (Data Science),Didática Tech,0.5690000000000001,,18,11,2021,YouTube,https://www.youtube.com/watch?v=sjpBNi4DgI0,https://i.ytimg.com/vi/sjpBNi4DgI0/hqdefault.jpg,480,360,"Vamos conhecer a Ciência de Dados, uma das áreas que mais cresce atualmente e é responsável por transformar dados em informações. Neste vídeo veremos seus co...",video.other,,90779.0
304,INTELIGÊNCIA ARTIFICIAL SEM RENDA UNIVERSAL PODE SER O FIM DO SER HUMANO,DESCE A LETRA SHOW - CORTES,17.0,,31,3,2023,YouTube,https://www.youtube.com/watch?v=4IXZlpf99-0,https://i.ytimg.com/vi/4IXZlpf99-0/maxresdefault.jpg,1280,720,EPISÓDIO COMPLETOhttps://youtu.be/9f0HPvkklLg_______INSCREVA-SE NO CANAL PRINCIPAL -  @DESCE A LETRA SHOWE SIGA TODO MUNDO@cauemoura@loadcomics@manualdomundo...,video.other,,69667.5
30,A Gentle Introduction to Machine Learning,StatQuest with Josh Starmer,11.0,,26,11,2018,YouTube,https://www.youtube.com/watch?v=Gv9_4yMHFhI,https://i.ytimg.com/vi/Gv9_4yMHFhI/maxresdefault.jpg,1280,720,"Machine Learning is one of those things that is chock full of hype and confusion terminology. In this StatQuest, we cut through all of that to get at the mos...",video.other,Introduction,988504.0
498,Projeto de Extensão Arquitetura de Dados - Unopar - Passo a Passo Desenvolvimento Completo.,Graduação Total,0.002,,19,3,2023,YouTube,https://www.youtube.com/watch?v=vHAPtA56QFs,https://i.ytimg.com/vi/vHAPtA56QFs/maxresdefault.jpg,1280,720,@unoparuniversidade   @anhanguera   @unoparuniversidade  @DeAlunoParaAluno  #anhanguera #unopar #gestão#arquitetura #arquitetura de dados #dados #informação ...,video.other,,310.5
265,Functional Data Engineering - A Set of Best Practices | Lyft,Data Council,1.4,,24,5,2018,YouTube,https://www.youtube.com/watch?v=4Spo2QRTz1k,https://i.ytimg.com/vi/4Spo2QRTz1k/maxresdefault.jpg,1280,720,Download slides: https://www.datacouncil.ai/talks/functional-data-engineering-a-set-of-best-practices?utm_source=youtube&utm_medium=social&utm_campaign=%20-%...,video.other,maxime beauchemin lyft,83515.0
209,Deep Learning - L01 O que é aprendizado de máquina e aprendizado profundo? Uma visão geral part1,Dalcimar Casanova,,,3,6,2020,YouTube,https://www.youtube.com/watch?v=l3YXuNJREOk,https://i.ytimg.com/vi/l3YXuNJREOk/maxresdefault.jpg,1280,720,Aula 01 - O que é aprendizado de máquina e aprendizado profundo? Uma visão geral.Os slides do curso códigos exemplos estão disponíveis em: https://github.com...,video.other,PPGEE,432.0
103,Aula 36 - Redes Neurais Convolucionais - Operação de Convolução,José Ricardo,0.067,,7,7,2020,YouTube,https://www.youtube.com/watch?v=_bCY53ZaSag,https://i.ytimg.com/vi/_bCY53ZaSag/maxresdefault.jpg,1280,720,Redes Neurais Convolucionais - Operação de Convolução,video.other,,401.0
295,How to learn DATA Science in 60Days? தமிழ்🔥😳Evlo easy ah,Curious Freaks,0.882,,11,3,2023,YouTube,https://www.youtube.com/watch?v=ZfPDT53JJzA,https://i.ytimg.com/vi/ZfPDT53JJzA/maxresdefault.jpg,1280,720,How to Become DATA Scientist in 60Days for FREE?🔥😳Salary Calculator: https://hubs.la/Q01Gn4Yg0Bootcamp: https://hubs.la/Q01Gn2tV0How to become data scienti...,video.other,how to become data analyst in 2023,33067.0
162,Como obter SUCESSO em Ciências de Dados e Programação,Jerry Strazzeri,,,16,9,2022,YouTube,https://www.youtube.com/watch?v=LdyXnHG3jZo,https://i.ytimg.com/vi/LdyXnHG3jZo/maxresdefault.jpg,1280,720,O que você deve estudar para Ciências de Dados e Programação? 🎯 Mais informações sobre o curso de Data - http://eepurl.com/hbGyG5💻 O que você deve estudar ...,video.other,,48064.25
308,"INTELIGÊNCIA ARTIFICIAL: ÁLVARO DIAS, CAVALLINI E MARTHA GABRIEL - Inteligência Ltda. Podcast #792",Inteligência Ltda,,3.12,6,4,2023,YouTube,https://www.youtube.com/watch?v=hs4qBDh9WeE,https://i.ytimg.com/vi/hs4qBDh9WeE/maxresdefault.jpg,1280,720,"ÁLVARO MACHADO DIAS, RICARDO CAVALLINI e MARTHA GABRIEL são experts em inteligência artificial e futurismo. Eles vão bater um papo sobre os benefícios da int...",video.other,alvaro machado podcast,503617.6666666667
270,Gerando imagens 360 com uma IA Generativa,CodaRam,0.003,,10,4,2023,YouTube,https://www.youtube.com/watch?v=siuekIDUzKQ,https://i.ytimg.com/vi/siuekIDUzKQ/maxresdefault.jpg,1280,720,O link do site para vocês testarem é esse aqui:https://skybox.blockadelabs.com/#ia #chatgpt #iaimage #gerarimagem #inteligenciaartifical #criarimagem#midjourney,video.other,midjourney free,31.0
76,Apresentação de Modelos Estatísticos,Pedro Sa Couto,0.003,,8,4,2020,YouTube,https://www.youtube.com/watch?v=jrhklz00K9A,https://i.ytimg.com/vi/jrhklz00K9A/maxresdefault.jpg,1280,720,,video.other,,386.0
87,Aula #5 - Resolva o Titanic Como um Campeão do Kaggle,Mario Filho,0.365,,19,8,2019,YouTube,https://www.youtube.com/watch?v=4I7YMPxps1k,https://i.ytimg.com/vi/4I7YMPxps1k/maxresdefault.jpg,1280,720,"Nesta aula, você vai aprender:- Como entender os números de sua validação- Como adicionar novas variáveis ao modelo- Como preparar o modelo para fazer previs...",video.other,#kaggle,7767.0
436,O fenômeno da IA Generativa  O #ChatGPT e a #OPenAI,Carlos Coan,,,28,1,2023,YouTube,https://www.youtube.com/watch?v=uiwv-Zverwc,https://i.ytimg.com/vi/uiwv-Zverwc/maxresdefault.jpg,1280,720,,video.other,,22303.0
287,How I'd become a Data Analyst | If I had to start all over again,Data With Mo,5.9,,22,2,2023,YouTube,https://www.youtube.com/watch?v=d_2fGS6QVDo,https://i.ytimg.com/vi/d_2fGS6QVDo/maxresdefault.jpg,1280,720,"I'll show you how I'd become a data analyst in 2023, if I had to do it all over again. I've learned so many cool, but very much unnecessary things along the ...",video.other,,310490.0
187,DATA ENGINEER COMPLETE ROADMAP - 2023🔥 NO SHORT CUT ❌ 6 Month | BEGINNER to ADVANCE 🚀,E-Learning Bridge,1.6,,2,2,2023,YouTube,https://www.youtube.com/watch?v=Po22ASXBatg,https://i.ytimg.com/vi/Po22ASXBatg/maxresdefault.jpg,1280,720,⭐ Subscribe to Hindi Channel - https://www.youtube.com/@datawalebhaiya219⭐ Follow Me On Instagram - https://www.instagram.com/_shashank_219/Jovian is startin...,video.other,cloud data engineer,11911.0
543,Risks of Large Language Models (LLM),IBM Technology,0.201,,14,4,2023,YouTube,https://www.youtube.com/watch?v=r4kButlDLUc,https://i.ytimg.com/vi/r4kButlDLUc/maxresdefault.jpg,1280,720,Learn more about how to safely and ethically us AI→ https://ibm.biz/BdPg3wLearn more about foundations models → https://ibm.biz/BdPhxZWith all the excitement...,video.other,chatbot hallucinations,27943.0
404,Modelo estatístico teórico #Cortes,A Ciência da Estatística,0.029,,1,6,2022,YouTube,https://www.youtube.com/watch?v=1WPk-tR6ick,https://i.ytimg.com/vi/1WPk-tR6ick/maxresdefault.jpg,1280,720,Corte da palestra sobre o valor-p e suas limitações que apresenta a definição do modelo estatístico teórico e das quantidades de interessePalestra completa: ...,video.other,Modelo estatístico,931.0
198,Data Science Full Course - 12 Hours | Data Science For Beginners [2023] | Edureka,edureka!,,3.75,9,1,2023,YouTube,https://www.youtube.com/watch?v=xiEC5oFsq2s,https://i.ytimg.com/vi/xiEC5oFsq2s/hqdefault.jpg,480,360,"🔥 𝐄𝐝𝐮𝐫𝐞𝐤𝐚 𝐃𝐚𝐭𝐚 𝐒𝐜𝐢𝐞𝐧𝐜𝐞 𝐂𝐞𝐫𝐭𝐢𝐟𝐢𝐜𝐚𝐭𝐢𝐨𝐧 𝐂𝐨𝐮𝐫𝐬𝐞 (Use code: ""𝐘𝐎𝐔𝐓𝐔𝐁𝐄𝟐𝟎"") : https://www.edureka.co/data-science-pyth...",video.other,Edureka,621459.0
62,Analisando a MODELAGEM do BANCO DE DADOS dos ESTAGIÁRIOS,DevMedia,2.9,,5,7,2022,YouTube,https://www.youtube.com/watch?v=AnMOqXOcsPk,https://i.ytimg.com/vi/AnMOqXOcsPk/maxresdefault.jpg,1280,720,Nossos estagiários estão evoluindo e hoje vamos testar a modelagem do banco de dados deles antes de partir pros comandos SQL. Será que eles passaram na avali...,video.other,modelagem de dados,26638.0
446,O que faz uma Cientista de Dados? com Mikaeri Ohana | #HipstersPontoTube,Alura,4.7,,30,3,2021,YouTube,https://www.youtube.com/watch?v=Zwvq-rlIHAw,https://i.ytimg.com/vi/Zwvq-rlIHAw/hqdefault.jpg,480,360,"A área de Ciência de Dados cresce a cada dia. Foi pensando nisso que recebemos Mikaeri Ohana, que trabalha na área, para conversar sobre o trabalho, ferramen...",video.other,dev,405521.6666666667
449,O que são séries temporais?,Engineering Brasil,0.015,,28,4,2022,YouTube,https://www.youtube.com/watch?v=gFqKyqwYUoA,https://i.ytimg.com/vi/gFqKyqwYUoA/maxresdefault.jpg,1280,720,"Veja o vídeo na íntegra!👉 https://www.youtube.com/watch?v=ZNc0rEn59DsO Machine Learning, dentro das séries temporais, vem trazer uma abordagem complementar ...",video.other,redes neurais python,1614.0
