,titulo,nome_canal,likes_video_(em_milhares),inscritos_canal_(em_milhoes),dia,mes,ano,nome_site,url,imagem,largura_imagem,altura_imagem,descricao,tipo,tags,visualizacoes
415,Nicolelis explica a Inteligência Artificial: seu potencial e os riscos,TV 247,,1.2,15,3,2023,YouTube,https://www.youtube.com/watch?v=zkHgsxYsYNs,https://i.ytimg.com/vi/zkHgsxYsYNs/maxresdefault.jpg,1280,720,O jornalista Leonardo Attuch entrevista o cientista Miguel Nicolelis sobre Inteligência Artificial.• Apoie o 247 em brasil247.com/apoio: https://www.brasil24...,video.other,tv 247,289751.5
28,9 Coisas que Automatizei com Python,Dev Aprender,5.3,,20,9,2021,YouTube,https://www.youtube.com/watch?v=vw_3iMuOvGg,https://i.ytimg.com/vi/vw_3iMuOvGg/maxresdefault.jpg,1280,720,Quer Viver de Python e Automação? Matricule-se➡ https://links.devaprender.com/ViverDePython✅𝗚𝗥𝗨𝗣𝗢 𝗧𝗘𝗟𝗘𝗚𝗥𝗔𝗠 𝗢𝗙𝗜𝗖𝗜𝗔𝗟 𝗗𝗢 𝗖𝗔𝗡𝗔𝗟: ▸ Ent...,video.other,automação em python,169228.0
319,Inteligência Artificial quer ACABAR comigo no Playform,Bitgamer,15.0,2.93,14,1,2023,YouTube,https://www.youtube.com/watch?v=9G5INao16FU,https://i.ytimg.com/vi/9G5INao16FU/maxresdefault.jpg,1280,720,"Inteligencia artificial quer acabar comigo no playform, seja bem vindo a mais um vide de playform com a fisica do gta 6, playform cria possibilidades muito e...",video.other,bonecos moles,548174.0
58,Algoritmo da retropropagação de erros (Backpropagation) para redes multi-layer perceptron,Centro de Excelência em IA \\x26 Deep Learning Brasil,0.732,,22,7,2018,YouTube,https://www.youtube.com/watch?v=DGNbd2FGw2s,https://i.ytimg.com/vi/DGNbd2FGw2s/hqdefault.jpg,480,360,Treinamento de redes multilayer perceptron multicamadas (MLP).Slides: http://www.inf.ufg.br/~anderson/deeplearning/20181/Aula%202%20-%20Multilayer%20Perceptr...,video.other,anderson soares,3514.0
232,ESTATÍSTICA - GRÁFICOS,Tutoriar EAD,4.2,,15,2,2014,YouTube,https://www.youtube.com/watch?v=xB1OZXHLmBE,https://i.ytimg.com/vi/xB1OZXHLmBE/maxresdefault.jpg,1280,720,WWW.TUTORIAR.COM.BRhttps://www.instagram.com/tutoriar_ead/https://www.facebook.com/tutoriar/,video.other,EXERCÍCIOS RESOLVIDOS,121025.66666666667
372,Las REDES NEURONALES ahora prestan ATENCIÓN! - TRANSFORMERS ¿Cómo funcionan?,Dot CSV,15.0,,27,9,2021,YouTube,https://www.youtube.com/watch?v=aL-EmKuB078,https://i.ytimg.com/vi/aL-EmKuB078/maxresdefault.jpg,1280,720,"¡No dejes de escuchar el podcast de tecnología ""Cuidado con las macros ocultas"" de Cuatroochenta! - 👉 https://www.cuidadoconlasmacrosocultas.com/ 👈Los Tran...",video.other,megatron-turing,96386.0
230,ESSA É PRA VOCÊ QUE PRECISA ENTENDER MACHINE LEARNING,Eduardo | Ciência dos Dados,,,Programado,,11,YouTube,https://www.youtube.com/watch?v=E4AxBtac_no,https://i.ytimg.com/vi/E4AxBtac_no/maxresdefault_live.jpg,1280,720,"Se você deseja ganhar de 5 a 12 mil como Cientista de Dados Profissional, não perca essa live por nada.Simbóra CDPRO (Cientista de Dados Profissional)",video.other,,28154.0
545,SACANDO  R$ 5MIL COM O ROBÔ DA JANELINHA - INTELIGÊNCIA ARTIFICIAL,Fernando Augusto,0.061,,12,4,2023,YouTube,https://www.youtube.com/watch?v=FgrlWNigR5I,https://i.ytimg.com/vi/FgrlWNigR5I/maxresdefault.jpg,1280,720,"🔥 https://www.estrategiadajanelinha.com.br/ - Conheça o robô mais rentável do Brasil, acesse o link ao lado para baixar ele aí no seu celular agora.✅Sobre e...",video.other,robô com inteligência artificial comprar,480862.0
658,😱URGENTE: CONCURSO IBGE EFETIVO 2023 AUTORIZADO?,Eduardo Cortez,0.317,,14,4,2023,YouTube,https://www.youtube.com/watch?v=b-9rxq_bXKg,https://i.ytimg.com/vi/b-9rxq_bXKg/maxresdefault.jpg,1280,720,"A ministra do Planejamento e Orçamento, Simone Tebet, disse nesta quinta-feira (13) que o governo vai retomar em breve os concursos públicos, que serão divid...",video.other,simone tebet ibge,4605.0
257,Estude Data Science e Analytics,Jerry Strazzeri,,,7,11,2022,YouTube,https://www.youtube.com/watch?v=GdzELwfvVkM,https://i.ytimg.com/vi/GdzELwfvVkM/maxresdefault.jpg,1280,720,Tudo sobre a nova turma de Data Science e Analytics.🎯 Mais informações sobre o curso de Data - http://eepurl.com/hbGyG5📮 Me siga no Instagram: https://www....,video.other,,22228.0
534,Redes Neurais Generativas Adversárias (GANs) Na Prática do Zero em PyTorch | Deep Learning #3,Programação Dinâmica,,,13,11,2021,YouTube,https://www.youtube.com/watch?v=BIEBJZ_Db7Y,https://i.ytimg.com/vi/BIEBJZ_Db7Y/maxresdefault.jpg,1280,720,"Redes neurais como você nunca viu! Nesta live, iremos estudar redes neurais generativas adversárias (GANs) e como podemos implementá-las usando a linguagem d...",video.other,rede neural,998.5
276,Google Open Source Expert Prize | Kaggle,Kaggle,0.08700000000000001,,15,3,2022,YouTube,https://www.youtube.com/watch?v=xhdGGaELYzo,https://i.ytimg.com/vi/xhdGGaELYzo/maxresdefault.jpg,1280,720,"We're co-sponsoring a new prize with Google to support the developer community's usage of Google's open source frameworks on Kaggle.With this program, Kaggle...",video.other,CS,17882.333333333332
385,MODECON-001. Logística del curso,John Cajas Guijarro,0.01,,16,5,2022,YouTube,https://www.youtube.com/watch?v=7_Z00nX_flI,https://i.ytimg.com/vi/7_Z00nX_flI/maxresdefault.jpg,1280,720,Tema: Logística del curso.Sitio web del curso: https://sites.google.com/view/econometria-jcg/materias/series-temporales,video.other,,211.0
553,Semana 1.1 - Introdução - Aprendizado de Máquina 2022.1 - Prof. Raphael Y. de Camargo,Raphael Camargo,0.034,,16,2,2022,YouTube,https://www.youtube.com/watch?v=LZ0YH9EaCT8,https://i.ytimg.com/vi/LZ0YH9EaCT8/maxresdefault.jpg?sqp=-oaymwEmCIAKENAF8quKqQMa8AEB-AH-CYAC0AWKAgwIABABGGUgZShlMA8=&rs=AOn4CLC40FnxrknXCHpy2_gu3UY9v-i_UQ,1280,720,"O que é aprendizado de máquina? O que veremos na disciplina?Esta aula introdutória aborda estes e outros pontosA disciplina é baseada no livro ""Gareth James,...",video.other,,18859.0
519,REDES NEURAIS CONVOLUCIONAIS: TUTORIAL COMPLETO | Redes Neurais e Deep Learning 09,Universo Discreto,0.178,,11,11,2021,YouTube,https://www.youtube.com/watch?v=0lvHURoyhtc,https://i.ytimg.com/vi/0lvHURoyhtc/maxresdefault.jpg,1280,720,Nesse vídeo eu explico o que você precisa saber para criar uma aplicação moderna de Visão Computacional capaz de classificar a imagem pelo conteúdo. No caso ...,video.other,redes convolucionais,3445.0
516,REAGINDO A ANTONIO MIRANDA A SUA SUPOSTA REFUTAÇÃO A MARCOS EBERLIN E RODRIGO SILVA (PARTE2),TEOLOGIA E HISTÓRIA,0.046,,6,4,2023,YouTube,https://www.youtube.com/watch?v=rxZP9-SQddU,https://i.ytimg.com/vi/rxZP9-SQddU/maxresdefault.jpg,1280,720,REAGINDO A ANTONIO MIRANDA A SUA SUPOSTA REFUTAÇÃO A MARCOS EBERLIN E RODRIGO SILVA NO FLOW PODCAST. (PARTE 2)========= Galera hoje no Teologia e Historia te...,video.other,,61760.5
237,Econometria - Regressão Linear Simples - Introdução Parte II,Docsity Português,0.536,,3,10,2017,YouTube,https://www.youtube.com/watch?v=e2QOZwJBlG4,https://i.ytimg.com/vi/e2QOZwJBlG4/maxresdefault.jpg,1280,720,"Aula de Econometria introduzindo Regressão Linear Simples Parte II.Para ver o curso completo, acesse https://estudar.com.vc/?utm_campaign=playyt-economet",video.other,formas,27814.0
657,🔵AGIX NÃO DEIXE AS BALEIAS TE DEIXAREM DE FORA! ESTAMOS DE FRENTE PARA A NOVA REALIDADE! MUITO LUCRO,Bruxo DeFi,0.10200000000000001,,12,4,2023,YouTube,https://www.youtube.com/watch?v=pUJwOeBawBw,https://i.ytimg.com/vi/pUJwOeBawBw/maxresdefault.jpg,1280,720,🔵Site de Cadastro para compra da pré venda da IVIPCOIN https://app.ivipcoin.com/UUE59ORM0CEH7OCL🔵Whitepaper: https://docs.ivipcoin.com.br🔵Telegram IVIPCOI...,video.other,criptomoeda agix hoje,1023.0
574,"The A.I. Dilemma - March 9, 2023",Center for Humane Technology,3.5,,5,4,2023,YouTube,https://www.youtube.com/watch?v=xoVJKj8lcNQ,https://i.ytimg.com/vi/xoVJKj8lcNQ/maxresdefault.jpg,1280,720,"Tristan Harris and Aza Raskin discuss how existing A.I. capabilities already pose catastrophic risks to a functional society, how A.I. companies are caught i...",video.other,,301741.0
23,57 - Simples Nacional - Identificaçao dos valores nas tabelas e cálculo. (Contabilidade).,Professor Quintino,0.619,,18,1,2021,YouTube,https://www.youtube.com/watch?v=ARicThSoQas,https://i.ytimg.com/vi/ARicThSoQas/maxresdefault.jpg,1280,720,"Este vídeo trata do Simples Nacional, que é um Regime Especial Unificado de Arrecadação de Tributos e Contribuições devidos pelas Microempresas e Empresas de...",video.other,renda bruta,3582.0
353,"Introdução às redes neurais convolucionais (ML de Zero a 100, parte 3)",TensorFlow,0.733,,13,11,2019,YouTube,https://www.youtube.com/watch?v=zAfBy74c2AI,https://i.ytimg.com/vi/zAfBy74c2AI/maxresdefault.jpg,1280,720,"This video is available in English: https://goo.gle/2O8U7QjNa parte três do Machine Learning de Zero a 100, André Lírio discute redes neurais convolucionais ...",video.other,Laurence Moroney,25806.0
445,O que faz um programador?,O Bruno Germano,18.0,,15,2,2019,YouTube,https://www.youtube.com/watch?v=DXTPjzFYs4k,https://i.ytimg.com/vi/DXTPjzFYs4k/maxresdefault.jpg,1280,720,O que faz um programador? Essa é uma pergunta que eu nunca me fiz e eu acho que as pessoas tem medo de me fazer. No vídeo de hoje eu falo faz um programador ...,video.other,programação,82574.0
155,"Como escolher o teste estatistico ideal - teste t, Mann-Whithney, Qui-quadrado",Easy-knowledge treinamentos,,,12,5,2020,YouTube,https://www.youtube.com/watch?v=OQdHXwhhUVI,https://i.ytimg.com/vi/OQdHXwhhUVI/maxresdefault.jpg,1280,720,Um algoritmo para que você possa saber qual teste descrever no seu projeto ou que tipo de analise precisaria ser feito no seus dadosAcompanhe nossos canais:I...,video.other,#revisaosistematica #easyknowledgetreinamentos #bioestatistica #profjosydavidson,5025.0
651,É ASSIM QUE VOCÊ DESCOBRE COMO DESENVOLVER APLICAÇÕES NA CIÊNCIA DE DADOS,Eduardo | Ciência dos Dados,0.007,,11,4,2023,YouTube,https://www.youtube.com/watch?v=5jT8sf58KOA,https://i.ytimg.com/vi/5jT8sf58KOA/maxresdefault.jpg,1280,720,É ASSIM QUE VOCÊ DESCOBRE COMO DESENVOLVER APLICAÇÕES NA CIÊNCIA DE DADOS.Me SIGA em todas as redes-----------------------------------------INSTAGRAM https:/...,video.other,,20873.0
630,Why Python is popular for machine learning,Lex Clips,2.1,,28,11,2022,YouTube,https://www.youtube.com/watch?v=hKZXLw9XiHA,https://i.ytimg.com/vi/hKZXLw9XiHA/maxresdefault.jpg,1280,720,Lex Fridman Podcast full episode: https://www.youtube.com/watch?v=-DVyjdw4t9IPlease support this podcast by checking out our sponsors:- GiveDirectly: https:/...,video.other,turing,240434.2
536,Redes Neurais e Machine Learning | Nerdologia Tech,Nerdologia,28.0,3.3,31,1,2019,YouTube,https://www.youtube.com/watch?v=1_c_MA1F-vU,https://i.ytimg.com/vi/1_c_MA1F-vU/maxresdefault.jpg,1280,720,ESTE NERDOLOGIA É UM OFERECIMENTO DA ALURAAcesse e aproveite a promoção da Alura com o Nerdologia Tech: http://bit.ly/Alura-Promocao-29CARREIRA ALURAFormação...,video.other,curiosidade,389778.5
86,Aula #4 - Resolva o Titanic Como um Campeão do Kaggle,Mario Filho,0.559,,13,8,2019,YouTube,https://www.youtube.com/watch?v=LxvFuLDXUdk,https://i.ytimg.com/vi/LxvFuLDXUdk/maxresdefault.jpg,1280,720,"Nesta aula, você vai aprender a usar uma técnica para tornar a sua validação mais confiável e remover um pouco da aleatoriedade: validação cruzada.- Qual o e...",video.other,,7073.0
392,Machine Learning em Python: por onde começar?,Caio Dallaqua,2.6,,30,3,2021,YouTube,https://www.youtube.com/watch?v=eqaskloXzgY,https://i.ytimg.com/vi/eqaskloXzgY/hqdefault.jpg,480,360,Receba conteúdos: https://forms.gle/9uuccRDykdXz36VC7Escolher qual framework de machine learning aprender primeiro é uma decisão praticamente inevitável pra ...,video.other,tensorflow,234276.0
356,J. Maya  - Machine Learning (Official Lyric Video),J. Maya,,,3,11,2022,YouTube,https://www.youtube.com/watch?v=Y5x8xvDnLXk,https://i.ytimg.com/vi/Y5x8xvDnLXk/maxresdefault.jpg?sqp=-oaymwEmCIAKENAF8quKqQMa8AEB-AH-CYAC0AWKAgwIABABGC4gZShyMA8=&rs=AOn4CLAFfSABNe6ti-ENyCG67vNhxQHCkA,1280,720,"""Machine Learning” is a song about social performance, about what happens when you construct so many different versions of yourself to please others that you...",video.other,,125440.0
604,"Veja o que é iot, a internet das coisas!!!",Eu TI Ensino,0.491,,21,1,2021,YouTube,https://www.youtube.com/watch?v=Ikvs6B2591M,https://i.ytimg.com/vi/Ikvs6B2591M/maxresdefault.jpg,1280,720,"Assista e veja o que é iot, a internet das coisas? o que é Internet of Things? Você com certeza já se pegou fazendo essas perguntas, não é mesmo?Hoje vamos e...",video.other,internet das coisas nerdologia,26743.5
184,Curso de Ciência de Dados (CCDD) 000 - Introdução ao Curso,Ignorância Zero,,,1,2,2022,YouTube,https://www.youtube.com/watch?v=CiUumyrp7Ow,https://i.ytimg.com/vi/CiUumyrp7Ow/maxresdefault.jpg,1280,720,"Introduzir o campo e o que faz o cientista de dados, os objetivos do curso, canais de comunicações usados, descrever as ferramentas a serem desenvolvidas, al...",video.other,análise de dados,3749.0
181,Criando sua primeira Rede Neural Convolucional com Pytorch (Tutorial Completo),Stack,0.128,,17,9,2021,YouTube,https://www.youtube.com/watch?v=m33QC_lArio,https://i.ytimg.com/vi/m33QC_lArio/maxresdefault.jpg,1280,720,Neste vídeo eu mostro como você vai criar sua rede neural convolucional e associar as teorias ao código na modelagem.**Código fonte**: https://github.com/sta...,video.other,redes neurais,758.0
63,Analise Espectral e Modelos ARIMA - Autocovariância,Estatística para Concurso,0.132,,1,2,2017,YouTube,https://www.youtube.com/watch?v=wu7M0UFrFvU,https://i.ytimg.com/vi/wu7M0UFrFvU/maxresdefault.jpg,1280,720,Análise Espectral e Modelos ARIMA - Nessa aula vamos ver a Resolução de Questão do Concurso para o IBGE/2010 realizado pela CESGRANRIO. Importante conhecer a...,video.other,modelos arima de séries temporais,16368.0
527,Redes Neurais Artificiais - Conceitos teóricos e práticos básicos - Matheus Pussaignolli,EstaTiDados,0.486,,19,9,2019,YouTube,https://www.youtube.com/watch?v=FCRStdk9hRg,https://i.ytimg.com/vi/FCRStdk9hRg/hqdefault.jpg,480,360,O que você vai aprender:- Introdução a um Neurônio;- Redes neurais artificiais;- Exemplos numéricos;- Aplicação no cenário energético Brasileiro;O nome da fe...,video.other,coeficiente de variação,4371.0
202,Data Scientist vs Data Analyst vs Data Engineer: What's the difference?,Recall by Dataiku,9.8,,29,4,2022,YouTube,https://www.youtube.com/watch?v=XW0YptcgZSk,https://i.ytimg.com/vi/XW0YptcgZSk/maxresdefault.jpg,1280,720,Twitter: https://twitter.com/dataikuInstagram: https://www.instagram.com/dataiku/From Joma Mediahttps://www.joma.media/,video.other,,48377.5
643,ep1 Aprendendo sobre máquinas que aprendem sobre a gente,Cérebro Eletrônico IFSP,0.221,,17,7,2020,YouTube,https://www.youtube.com/watch?v=sqLb_DzHmvE,https://i.ytimg.com/vi/sqLb_DzHmvE/hqdefault.jpg,480,360,Cérebro Eletrônico - episódio 1Aprendendo Sobre Máquinas que Aprendem Sobre a GenteO que é Inteligência Artificial? Aprendizado de Máquina ou Machine Learnin...,video.other,,1282.0
44,A rotina de uma desenvolvedora de software,Rafaella Ballerini,44.0,,14,,2020,YouTube,https://www.youtube.com/watch?v=R8of-SVzxJU,https://i.ytimg.com/vi/R8of-SVzxJU/maxresdefault.jpg,1280,720,"Quer se aprofundar mais? Aproveite o desconto na Alura: https://alura.com.br/promocao/rafaballerini 🤿Lembrando que tem curso meu por lá de HTML e CSS, além ...",video.other,ti,639948.0
538,Redes Neurais: Por que são tão poderosas? | #AluraMais,Alura,0.627,,3,11,2020,YouTube,https://www.youtube.com/watch?v=Xs1MMj8C4t4,https://i.ytimg.com/vi/Xs1MMj8C4t4/maxresdefault.jpg,1280,720,"Quando o assunto é aprendizado de máquina, as Redes Neurais viraram sinônimo de bom desempenho em aplicações que envolvem dados muito complexos como texto, i...",video.other,teorema da aproximação universal,4270.0
398,Minha Primeira Rede Neural (Prática em Python) - Redes Neurais e Deep Learning 02,Universo Discreto,0.604,,1,11,2020,YouTube,https://www.youtube.com/watch?v=NFZwmiKTFfI,https://i.ytimg.com/vi/NFZwmiKTFfI/maxresdefault.jpg,1280,720,"Nesse vídeo, eu explico o funcionamento do neurônio artificial de uma maneira bem simples e visual, sem deixar de passar o código e a matemática. Eu começo c...",video.other,rede neural python,3930.0
347,Introdução à Ciência de Dados - Introdução à Ciência de Dados,UNIVESP,1.1,1.2,13,10,2021,YouTube,https://www.youtube.com/watch?v=z6jbqkmshig,https://i.ytimg.com/vi/z6jbqkmshig/maxresdefault.jpg,1280,720,"univesp.brCiência de Dados - COM350 Univesp - Universidade Virtual do Estado de São Paulo Professor: José Eduardo Santarem SegundoNesta primeira videoaula,  ...",video.other,métodocientífico,4980.0
179,Could a Large Language Model be Conscious - David Chalmers [NIPS 2022],beringatavirus,0.077,,13,2,2023,YouTube,https://www.youtube.com/watch?v=j6cCXg-rjRo,https://i.ytimg.com/vi/j6cCXg-rjRo/maxresdefault.jpg?sqp=-oaymwEmCIAKENAF8quKqQMa8AEB-AH-CYAC0AWKAgwIABABGGggaChoMA8=&rs=AOn4CLAqBV_TFpR_pJrIdP_p_FmSwV_fVQ,1280,720,,video.other,,12129.0
266,GPT-4 Creator Ilya Sutskever,Eye on AI,,,15,3,2023,YouTube,https://www.youtube.com/watch?v=SjhIlw3Iffs,https://i.ytimg.com/vi/SjhIlw3Iffs/maxresdefault.jpg,1280,720,"GPT-4 co-creator Ilya Sutskever, co-founder and chief scientist at OpenAI, talks about large language models, hallucinations and his vision of AI-aided democ...",video.other,OPENAI,105956.5
636,[Live] - Utilizando modelos estatísticos para operar - (14/05/2019),ActivTrades Português,0.088,,16,5,2019,YouTube,https://www.youtube.com/watch?v=Ha4vjU14w_s,https://i.ytimg.com/vi/Ha4vjU14w_s/maxresdefault.jpg,1280,720,💹 Siga os mercados em direto: https://activtrades.ws/3uCkYuT✅ Teste suas estratégias de trading em tempo real: https://activtrades.ws/3uCkYuT Ativos negocia...,video.other,activtrades,7204.0
414,Métodos de Pesquisa - Econometria - 2018,FGV EAESP Pesquisa,0.267,,29,11,2018,YouTube,https://www.youtube.com/watch?v=uR6gBmdpn4c,https://i.ytimg.com/vi/uR6gBmdpn4c/maxresdefault.jpg,1280,720,"Nesse vídeo, o prof. Rafael Felipe Schiozer fala sobre o método Econometria, oferecido na Escola de Métodos",video.other,Pesquisa,10740.0
41,A data science como a nova ciência social definitiva | Kaike Nanne,Café Filosófico CPFL,1.6,,6,10,2019,YouTube,https://www.youtube.com/watch?v=zNoLeZi5gpk,https://i.ytimg.com/vi/zNoLeZi5gpk/maxresdefault.jpg,1280,720,"É difícil pensar num aspecto da nossa vida que não esteja relacionado, de algum modo, a um computador. Involuntariamente e até de maneira voluntária, pouco a...",video.other,privacidade,280504.6666666667
67,Análise de padrão de compra com Regras de Associação,IA Expert Academy,0.057,,2,6,2020,YouTube,https://www.youtube.com/watch?v=Oq_kM6M_KQ0,https://i.ytimg.com/vi/Oq_kM6M_KQ0/maxresdefault.jpg,1280,720,Nessa videoaula você será apresentado a noções introdutórias sobre o estudo de caso que vamos trabalhar com uma base de dados do Kaggle para identificar padr...,video.other,algoritmo apriori,896.0
201,Data Science: por onde eu começo? | Universo Data Science #01,Alura,2.2,,3,5,2022,YouTube,https://www.youtube.com/watch?v=K-eaT4V8j-w,https://i.ytimg.com/vi/K-eaT4V8j-w/hqdefault.jpg,480,360,"Tem websérie nova no canal! 🤩Nesse primeiro episódio de ""Universo Data Science"" vamos descobrir como a ideia da ciência de dados surgiu e acompanhar a sua e...",video.other,cientista de dados,7046.0
524,Rede Neural Artificial reconhecendo dígitos escritos à mão!,Universo Programado,4.5,,26,1,2018,YouTube,https://www.youtube.com/watch?v=nF5XDp5d_FA,https://i.ytimg.com/vi/nF5XDp5d_FA/maxresdefault.jpg,1280,720,Neste vídeo você verá uma rede neural artificial reconhecendo dígitos escritos à mão!Music from Jukedeck - create your own at http://jukedeck.com,video.other,inteligencia,260718.0
14,10 passos para me tornar um Arquiteto de Dados,Marcelo Leite,0.145,,22,6,2021,YouTube,https://www.youtube.com/watch?v=6LCiLkADk28,https://i.ytimg.com/vi/6LCiLkADk28/hqdefault.jpg?sqp=-oaymwEmCOADEOgC8quKqQMa8AEB-AH-DoACuAiKAgwIABABGHIgUyhDMA8=&rs=AOn4CLDy_vCqH-s1i-cGKK05N2c0mHHwBw,480,360,"O mercado de dados é um dos que mais cresce em todo o mundo, mas também um dos mais carentes de pessoas. Especialidades como a de Arquitetura de Dados, podem...",video.other,,4522.0
27,7 PERIGOS DA INTELIGÊNCIA ARTIFICIAL - O Avanço da Tecnologia - Lamartine Posella,Lamartine Posella,5.8,1.0,5,4,2023,YouTube,https://www.youtube.com/watch?v=8yVFjGrRJIQ,https://i.ytimg.com/vi/8yVFjGrRJIQ/maxresdefault.jpg,1280,720,Seja membro e participe do nosso curso de teologia 👇📖 https://is.gd/CursoDeTeologia7 PERIGOS DA INTELIGÊNCIA ARTIFICIAL - O Avanço da Tecnologia - Lamartin...,video.other,profecias da biblia,241173.0
294,How to build a data science portfolio with Dimitre Oliveira | Kaggle #30daysofML 2021,Kaggle,0.437,,20,10,2021,YouTube,https://www.youtube.com/watch?v=bsSlQ5mhdLU,https://i.ytimg.com/vi/bsSlQ5mhdLU/maxresdefault.jpg,1280,720,SUBSCRIBE: https://www.youtube.com/c/kaggle?sub_confirmation=1&utm_medium=youtube&utm_source=channel&utm_campaign=yt-subAbout Kaggle:Kaggle is the world's la...,video.other,CS,49511.4
542,Resolva o Titanic Como um Campeão do Kaggle | Curso Completo,Mario Filho,0.179,,21,6,2022,YouTube,https://www.youtube.com/watch?v=1KguWZH4hXw,https://i.ytimg.com/vi/1KguWZH4hXw/maxresdefault.jpg,1280,720,"Repost das aulas do tutorial de machine learning com o Titanic, só que em um vídeo só para ficar mais fácil de assistir.Timestamps:0:00 Aula 19:00 Aula 224:1...",video.other,,2695.6666666666665
59,Algoritmo de recomendação do Twitter foi “vazado” no GitHub [Cortes do Compilado],Compilado do Código Fonte TV \\x5bOFICIAL\\x5d,0.083,,9,4,2023,YouTube,https://www.youtube.com/watch?v=0tKN2h8p0sg,https://i.ytimg.com/vi/0tKN2h8p0sg/maxresdefault.jpg,1280,720,Esse é o corte de uma notícia que fez parte do Compilado #97Assista ao episódio completo em https://youtu.be/mW8T6O3cLWA#CompiladoPodcast #CDFTV #Podcast #Te...,video.other,NVidia,1006.0
602,VALE A PENA GASTAR COM ARQUITETO? | Cortes do Venus,Cortes do Venus \\x5bOFICIAL\\x5d,10.0,,17,3,2021,YouTube,https://www.youtube.com/watch?v=fCQpwyI95MM,https://i.ytimg.com/vi/fCQpwyI95MM/maxresdefault.jpg,1280,720,FELIPE PRIOR - Venus Podcast #21https://youtu.be/_FQUrA8TOQ8----------Edição:@pedrocastellen@perceubros@coke1337,video.other,,53118.0
577,The Narrated Transformer Language Model,Jay Alammar,3.3,,26,10,2020,YouTube,https://www.youtube.com/watch?v=-QH8fRhqFHM,https://i.ytimg.com/vi/-QH8fRhqFHM/maxresdefault.jpg,1280,720,AI/ML has been witnessing a rapid acceleration in model improvement in the last few years. The majority of the state-of-the-art models in the field are based...,video.other,,167593.0
89,Aula - Perceptron e Adaline,Centro de Excelência em IA \\x26 Deep Learning Brasil,0.553,,30,4,2018,YouTube,https://www.youtube.com/watch?v=6yYUc6nU3Cw,https://i.ytimg.com/vi/6yYUc6nU3Cw/hqdefault.jpg,480,360,"Primeira aula do curso de redes neurais profundas (Deep Learning). Neurônio artificial, perceptron, adaline e processo de treinamento.Lista de exercícios: ht...",video.other,neurônio artificial,21024.0
646,¿Cómo funciona la inteligencia artificial?,LA NACION,0.181,1.7000000000000002,11,4,2023,YouTube,https://www.youtube.com/watch?v=oydCCu5i-6Q,https://i.ytimg.com/vi/oydCCu5i-6Q/maxresdefault.jpg,1280,720,,video.other,,602040.5
37,A TUPPERWARE ESTÁ FALINDO!?! SAIBA TUDO SOBRE A QUEDA DE QUASE 50% DA EMPRESA NO MERCADO 😭,Aldemi Junior,,,10,4,2023,YouTube,https://www.youtube.com/watch?v=n4Gkt6XCEMI,https://i.ytimg.com/vi/n4Gkt6XCEMI/hqdefault.jpg,480,360,"❤️ ADQUIRA O NOVO MINI CURSO COM 50% DE DESCONTO AQUI POR APENAS R$39,99https://mywhats.net/minicursotupperware3",video.other,,6588.0
585,Transformer Series: Part-1 Basic Introduction (Dr. Aditya Nigam),Deep learning for all at IIT Mandi - Aditya Nigam,0.017,,13,,2021,YouTube,https://www.youtube.com/watch?v=GGnjvT2p_aY,https://i.ytimg.com/vi/GGnjvT2p_aY/maxresdefault.jpg,1280,720,,video.other,,479.0
291,How to Get Started with Kaggle’s Titanic Competition | Kaggle,Kaggle,9.9,,30,9,2019,YouTube,https://www.youtube.com/watch?v=8yZMXCaFshs,https://i.ytimg.com/vi/8yZMXCaFshs/maxresdefault.jpg,1280,720,"New to Kaggle? Our Titanic competition is a great place to start. In this video, Kaggle data scientist Dr. Rachael Tatman walks you through the Titanic compe...",video.other,CS,2906.0
88,Aula #6 - Resolva o Titanic Como um Campeão do Kaggle,Mario Filho,0.583,,26,8,2019,YouTube,https://www.youtube.com/watch?v=bGkMG3yLg5Q,https://i.ytimg.com/vi/bGkMG3yLg5Q/maxresdefault.jpg,1280,720,Você já leu sobre uma solução de machine learning e pensou: como essa pessoa teve essa ideia? Isso acontece muito quando vemos soluções de vencedores de comp...,video.other,,2287.5
269,GRÁFICOS ESTATÍSTICOS | ESTATÍSTICA,Dicasdemat Sandro Curió,7.8,1.2,8,3,2021,YouTube,https://www.youtube.com/watch?v=GDEkkbwvhNg,https://i.ytimg.com/vi/GDEkkbwvhNg/maxresdefault.jpg,1280,720,"Friend, aprenda em poucos minutos a analisar os gráficos que mais caem nas provas de estatística.Gráfico de linha, barras, colunas, setores e outros.Te convi...",video.other,Exercícios,487174.0
90,"Aula 01: Melhore a Gestão dos seus Dados, faça Previsão, aprenda agora Análise de Séries Temporais!",Alexandre Cunha Costa,0.321,,18,8,2020,YouTube,https://www.youtube.com/watch?v=emnSZ7qKv9M,https://i.ytimg.com/vi/emnSZ7qKv9M/maxresdefault.jpg,1280,720,"Olá, seja bem-vindo, eu sou o Prof. Alexandre Cunha CostaCV: http://lattes.cnpq.br/9241372014553970Este é o primeiro vídeo de uma série sobre Introdução à An...",video.other,análise de dados,3177.0
